,date,timestamp,main_title,main_content,feature_title_0,feature_title_1,feature_title_2,video_title_0,video_title_1,video_title_2,stories_title_0,stories_title_1,stories_title_2,stories_title_3,stories_title_4,stories_title_5,stories_content_0,stories_content_1,stories_content_2,stories_content_3,stories_content_4,stories_content_5
10,20181211,20181211114201,Huawei CFO back in Canada court as bail hearing set to wrap,"A top executive at Chinese telecoms giant Huawei Technologies [HWT.UL] is set to return to a Vancouver courtroom on Tuesday, as the judge weighs final issues in determining whether she should be freed on bail while awaiting extradition proceedings.",Exclusive: Hyundai Motor's two R&D; vice chairmen offer to resign - sources,Court rejects Nissan ex-chairman Ghosn's appeal to end detention,China court bans sales of older iPhone models in Apple-Qualcomm global battle,Huawei CFO back in Canada court as bail hearing set to wrap,"Investors worry about possible policy mistake, says U.S. Bank's Eric Wiegand",Wall Street ends choppy day higher,Daimler to buy $23 billion of battery cells for electric car drive,Uber's dominant size may rob smaller Lyft of its IPO oxygen,"Slight bounce masks unease over Brexit, trade and growth",U.S. fund Castlelake to buy planes from AirAsia in $800 million deal: sources,Hyundai readies Palisade large SUV in another shot at U.S. market,Vivendi seeks shareholders meeting to change Telecom Italia board,"Daimler  will buy battery cells worth more than 20 billion euros ($23 billion) by 2030 as it readies mass production of hybrid and electric vehicles, the maker of Mercedes-Benz cars said on Tuesday.","Uber Technologies Inc [UBER.UL] and smaller rival Lyft are driving side-by-side on the road to a stock market debut, and that may not bode well for Lyft as investors decide where to place their bets in the ride-hailing sector.","Stocks rose tentatively on Tuesday as investors picked through the rubble of conflagrations in some of the world's top economies amid heightened uncertainty over Brexit, a China-U.S. trade war and French protests.","U.S. private investment firm Castlelake LP has struck a deal to buy a portfolio of about 30 narrowbody planes from AirAsia Group Bhd  for a total price of roughly $800 million, people familiar with the transaction said.","Hyundai Motor Co  on Tuesday began South Korean sales of its Palisade large sport utility vehicle (SUV), a model it hopes will spearhead a sales recovery in the United States when launched in its major overseas market next year.","Vivendi  is calling for a shareholders meeting to change the board at Telecom Italia  including five members proposed by activist fund Elliott, the French media conglomerate said on Tuesday."
11,20181212,20181212113622,Canada frees CFO of China's Huawei on bail; Trump might intervene,"A top executive of Chinese telecoms giant Huawei Technologies Co Ltd was granted bail by a Canadian court on Tuesday, 10 days after her arrest in Vancouver at the request of U.S. authorities sparked a diplomatic dispute.",Trump says would intervene in arrest of Chinese executive,Amazon aims at office workers with compact cashier-less food store,Stocks cheered by Trump trade talk; sterling claws off lows,Google has no plans to launch Chinese search engine,Exclusive: Trump says he would intervene in Huawei case,Google CEO gets a tongue-lashing on Capitol Hill,Washington takes center stage in bank branch battles,"Exclusive: Don't contact our board members, Renault tells Nissan - sources",Exclusive: Airbus staff error led to fatal Mali copter crash - German official,Samsung to shut mobile phone plant in China's Tianjin,"Rolls-Royce expects 2018 profit, free cash flow in upper half of forecast range","Exclusive: Trump says Fed shouldn't hike rates, but calls Powell 'a good man'","JPMorgan Chase & Co  has made a splash this year in Washington, D.C. opening branches for the first time in the nation's capital.","Renault  told alliance partner Nissan  to stop contacting the French company's directors ahead of a Thursday board meeting as the Japanese automaker tried to share evidence of wrongdoing by its ousted chairman Carlos Ghosn, two sources said.","The fatal crash of a German armed forces helicopter in Mali last year was caused by the failure of mechanics from manufacturer Airbus to correctly set the aircraft's rotor controls after repairs, a defense official told Reuters on Wednesday.","Samsung Electronics will cease operations at one of its mobile phone manufacturing plants in China, the company said, as its sales in the world's biggest smartphone market slumps amid rising competition from lower-cost local rivals.","Rolls-Royce  expects its 2018 group profit and free cash flow to be in the upper half of its guidance range, the British engineering company said on Wednesday, shrugging off problems with some of its aircraft engines.","President Donald Trump said on Tuesday it would be a mistake if the Federal Reserve raises interest rates when it meets next week, as it is expected to do, continuing his criticism of the U.S. central bank."
12,20181213,20181213114445,OPEC exit frees Qatar from U.S. legal concerns,"Even before taking over Qatar's energy policy in a government reshuffle last month, Qatar Petroleum (QP) CEO Saad al-Kaabi had long wanted the Gulf state to leave OPEC.","Vitol, rival oil traders in spotlight of Brazil bribery probe","Stocks wait for ECB signals, pound strong after Brexit drama",IEA sees global oil supply tightening more quickly in 2019,Under Armour sinks as forecasts disappoint,Wall Street rises on trade optimism,China's Tencent Music debut strikes a chord with investors,Airbus strategy review augurs clean break under new CEO,"Chinese state media urges Canada to defy U.S., free Huawei executive",Top German court rules Uber limousine service illegal,Apple to build new $1 billion campus in Texas,"VW's Skoda deliveries drop in November on China, January-November shipments up","Japan's SoftBank to shun Huawei in favor of Ericsson, Nokia equipment: Nikkei","Airbus has launched a strategic review to outline changes under incoming chief executive Guillaume Faury as it faces industrial challenges and prepares for overdue modernization, industry sources said.","Canada should distance itself from U.S. ""hegemonism"" and grant unconditional freedom to Meng Wanzhou, a top executive of China's Huawei detained in Vancouver on Washington's request, state-owned tabloid Global Times said in a Thursday editorial.","Germany's highest court ruled on Thursday that a defunct limousine service offered by Uber [UBER.UL] was illegal, in a setback for the U.S. ride-hailing company that has struggled to comply with the law in Europe's largest economy.","Apple Inc  said on Thursday it would invest $1 billion to build a second campus in North Austin, Texas and another $10 billion for new data centers over the next five years, as it aims to create 20,000 jobs in the United States.","Czech carmaker Skoda Auto, part of the Volkswagen Group, delivered 1.149 million vehicles in the January-November period, a 5.1 percent rise from a year ago, it said on Thursday.","SoftBank Group Corp plans to replace 4G network equipment from China's Huawei Technologies Co Ltd with hardware from Nokia and Ericsson, Nikkei reported on Thursday, without citing sources."
13,20181214,20181214121519,Apple to push software update in China as Qualcomm case threatens sales ban,"Apple Inc, facing a court ban in China on some of its iPhone models over alleged infringement of Qualcomm Inc patents, said on Friday it will push software updates to users in a bid to resolve potential issues.",China says to halt additional tariffs on U.S.-made cars from Jan. 1,Renault board did not consider replacing Ghosn: interim chairman,LVMH splashes out on luxury hotels with $3.2 billion Belmond deal,S&P; 500 ends choppy session flat,General Electric shares jump,"Apple to build second campus in Austin, TX","Ahead of China anniversary, trade war fans calls for faster market reforms",World stocks tumble on weak economic data from China and Europe,Merck to bolster animal health unit with $2.4 billion purchase of Antelliq,"SoftBank telco IPO sees strong demand despite Huawei, network disruption",Jet Airways' survival may rest on founder Goyal leaving the cockpit,New problems for embattled Huawei in France and Germany,"China's trade war with the United States is spurring some Chinese entrepreneurs, government advisers and think-tanks to call for faster reforms in the world's second-largest economy and the freeing of a private sector stifled by state controls.",Stocks worldwide tumbled on Friday after weak economic data from China and Europe fanned concerns of a global economic slowdown and left investors fretting over the wider impact of a still-unresolved Sino-U.S. trade dispute.,"U.S. drugmaker Merck and Co  said on Friday it would buy privately held Antelliq Group, which makes digital identification products for animals, for about 2.1 billion euros  ($2.37 billion).","Domestic investors have sought nearly double the number of shares offered by SoftBank Group Corp's  soon-to-list wireless unit, two sources from a lead IPO underwriter said, underscoring strong demand for Japan's third-largest telco.","Jet Airways Ltd's  69-year-old founder Naresh Goyal, who started out as an assistant in a travel agency, wove together charm, persistence and consummate dealmaking to build India's biggest full-service carrier.",Huawei [HWT.UL] faces fresh challenges in Europe after France's Orange said it would not hire the Chinese firm to build its next-generation network and Germany's Deutsche Telekom announced it would review its vendor strategy.
14,20181215,20181215112621,J&J; shares nosedive on report it knew of asbestos in Baby Powder,"Shares of Johnson & Johnson  fell 10 percent on Friday and were on track to post their biggest percentage drop in more than 16 years, after Reuters reported that the pharma major knew for decades that cancer-causing asbestos lurked in its Baby Powder.","Exclusive: T-Mobile, Sprint see Huawei shun clinching U.S. deal - sources",Wall St. looks to Fed outlook Wednesday for early Christmas gift,Boeing opens first 737 plant in China amid U.S.-Sino trade war,"T-Mobile, Sprint consider dropping Huawei",Facebook finds bug exposing users' photos,J&J; shares nosedive on baby powder worries,CVS defends settlement that allowed Aetna merger as judge assesses,U.S. sets new March 2 date for China tariff increases amid talks,"China should free Canadians held after Huawei arrest, U.S.'s Pompeo says",Anti-harassment groups share $20 million CBS handout after Moonves exit,Small-cap S&P; 600 index confirms bear market,California regulator opens case against PG&E; for falsifying pipeline safety records,"CVS Health Corp  defended on Friday an agreement with the U.S. Justice Department which allowed it to purchase health insurer Aetna for $69 billion, a settlement that a federal judge is still assessing.","The U.S. Trade Representative's office on Friday officially changed the scheduled date of a tariff rate increase on $200 billion worth of Chinese goods to 12:01 a.m. EST (0501 GMT) on March 2, 2019 as the United States and China pursue talks on trade and intellectual property.",U.S. Secretary of State Mike Pompeo said on Friday China should free two Canadian citizens who were detained this week after authorities in Canada arrested a senior Chinese technology executive on a U.S. extradition warrant.,CBS Corp  on Friday named the Time's Up anti-sexual harassment group and 17 other organizations that will share a $20 million donation stemming from the exit of its chief executive Les Moonves following allegations of sexual misconduct.,"As U.S. stocks have been rocked by trade tensions and monetary policy worries, shares of small-cap companies, by one measure, have now confirmed that they are in their first bear market in three years.","The California Public Utilities Commission has opened a proceeding to consider penalties against Pacific Gas and Electric Company, ordering immediate action against the utility for falsifying safety documents for natural gas pipelines, the regulator said in a statement on Friday."
15,20181216,20181216115153,Wall St. looks to Fed outlook Wednesday for early Christmas gift,"Investors are eager for a touch of Christmas cheer from the U.S. Federal Reserve next week, hoping for signs the central bank may ease up on interest rate hikes next year and spark a Santa Claus rally.",Qatar Petroleum to invest $20 billion in U.S. in major expansion,Nord Stream 2 can be justified if Ukraine's interests safeguarded,Germany plans to lower threshold for probes of foreign takeovers: Handelsblatt,"T-Mobile, Sprint consider dropping Huawei",Facebook finds bug exposing users' photos,J&J; shares nosedive on baby powder worries,"Exclusive: T-Mobile, Sprint see Huawei shun clinching U.S. deal - sources",OPEC has shown it can reach deal despite splits: Iran oil minister,Boeing opens first 737 plant in China amid U.S.-Sino trade war,Motiva preliminarily picked to run Curacao refinery: report,2018: The year volatility came home to roost,CVS defends settlement that allowed Aetna merger as judge assesses,"(This story corrects paragraph 8 to show Wanzhou was arrested in Canada, not China)",Iranian Oil Minister Bijan Zanganeh praised OPEC on Saturday for what he said was the producer group's ability to reach agreement despite intense internal political differences.,"Boeing Co  opened its first 737 completion plant in China on Saturday, a strategic investment aimed at building a sales lead over arch-rival Airbus  in one of the world's top travel markets that has been overshadowed by the U.S-China trade war.","Motiva Enterprises has preliminarily been chosen by the government of Curacao to operate the 335,000-barrel-per-day Isla refinery, replacing Venezuela's state-run PDVSA, local media said on Saturday.","U.S. stocks are down only slightly for 2018, but that masks a volatile year for investors.","CVS Health Corp  defended on Friday an agreement with the U.S. Justice Department which allowed it to purchase health insurer Aetna for $69 billion, a settlement that a federal judge is still assessing."
16,20181217,20181217120256,"Malaysia files criminal charges against Goldman, ex-bankers in 1MDB probe",Malaysia on Monday filed criminal charges against Goldman Sachs and two of the U.S. bank's former employees in connection with an investigation into suspected corruption and money laundering at state fund 1MDB.,Google to spend $1 billion to establish new campus in New York,German union calls strike at Amazon warehouses,Mercedes-Benz cuts China prices after tariff on U.S.-made cars suspended,Week ahead: the Fed ...,"T-Mobile, Sprint consider dropping Huawei",Facebook finds bug exposing users' photos,Brazil's Embraer says it has finalized deal terms with Boeing,Stocks steady as investors pin hopes on policy makers,Nissan hopes Renault will listen about Ghosn misconduct,Nestle to cut about 380 jobs at four locations in Germany,China trade steps seen as good start but leave core U.S. demands untouched,German regional state to sue VW over diesel scandal: FAZ,Brazil's Embraer  said on Monday it had finalized the terms of a proposed deal to sell 80 percent of its commercial aviation business to Boeing .,Markets started cautiously as the concern over global growth that sent world stocks to 17-month lows was only partly tempered by expectations of encouraging messages from the United States and China.,Nissan's  Chief Executive said on Monday he hoped alliance partner Renault SA  will listen to its explanation of financial misconduct by former Chairman Carlos Ghosn.,"Swiss food giant Nestle  is cutting around 380 jobs in Germany by closing two locations and reducing the workforce at two others as it reacts to lower demand and shifts some production elsewhere, the company said on Monday.","The United States has welcomed Chinese concessions since the two declared a trade war truce in early December, but trade experts and people familiar with negotiations say Beijing needs to do far more to meet U.S. demands for long-term change in how China does business.","The German state of Baden-Wuerttemberg plans to sue Volkswagen over the carmaker's cheating of emissions tests, newspaper Frankfurter Allgemeine Zeitung (FAZ) reported on Monday."
17,20181218,20181218123233,J&J; moves to limit impact of Reuters report on asbestos in Baby Powder,"Johnson & Johnson on Monday scrambled to contain fallout from a Reuters report that the healthcare conglomerate knew for decades that cancer-causing asbestos lurked in its Baby Powder, taking out full-page newspaper ads defending its product and practices, and readying its chief executive for his first television interview since investors erased tens of billions of dollars from the company’s market value.",Huawei to spend $2 billion over five years in cybersecurity push,Malaysia says Goldman Sachs failed to disclose key facts in 1MDB bond sales,Growth fears grip world markets ahead of Fed meeting,"A world away, sting lingers from Fed's rate hikes",'Who would be the stupidest person America could elect president?',CBS denies Moonves $120 million severance,Kroger starts use of unmanned vehicles for delivery in Arizona,Twitter tumbles on concerns about hacking activity,Renault-Nissan leaders to meet amid alliance crisis,"Qualcomm says Apple violating Chinese court order, despite new software","T-Mobile, Sprint win U.S. security approvals for merger",CBS fires CEO Leslie Moonves and denies $120 million severance,"U.S. supermarket chain Kroger Co  said on Tuesday it has started using unmanned autonomous vehicles to deliver groceries Scottsdale, Arizona in partnership with Silicon Valley startup Nuro.","Twitter Inc  shares fell almost 7 percent on Monday after the company said it was investigating unusual traffic that might be from state-sponsored hackers and, in what appeared to be an unrelated issue, a security firm said hackers used the platform to try to steal user data.","The head of Nissan and acting CEO of Renault will hold talks during a two day meeting of their carmaking partnership starting on Tuesday, sources said, amid a crisis in relations sparked by the arrest of long-time alliance supremo Carlos Ghosn.",Qualcomm Inc said it believes Apple Inc remains in violation of a Chinese court's orders to stop selling iPhones despite a software update that Apple pushed on Monday.,"T-Mobile US Inc and Sprint Corp have won backing for their $26 billion merger from two national security reviews on Monday, clearing key hurdles in their tie-up bid.",CBS Corp said on Monday it has fired Leslie Moonves for cause and has denied a $120 million severance package as it girds for a potential legal battle with its former chief executive who has been accused of sexual harassment and assault that allegedly took place before and after he joined the company.
18,20181219,20181219114505,Elon Musk unveils his first Los Angeles-area tunnel,Billionaire entrepreneur Elon Musk made a brief public appearance late on Tuesday to unveil the first tunnel completed by the underground transit venture he launched two years ago as an ambitious remedy to Los Angeles' infamously heavy traffic.,World stocks and oil try to scrabble higher after plunge,"Fed expected to raise rates, may signal fewer hikes ahead",Drugmaker GSK to split after striking Pfizer consumer health deal,SoftBank Corp suffers debut drop after record IPO,No Christmas cheer for fashion firms in never-ending sales,SoftBank Corp suffers Japan debut drop after record IPO,Volkswagen buys connected car unit from Volvo,BP launches $3 billion sale of U.S. onshore assets to fund BHP deal: sources,Malaysia charges another ex-Goldman Sachs banker over 1MDB,SoftBank telco suffers $9 billion slump on debut after record IPO,"J&J; says Indian drug regulators visited facilities, took talc samples",Bristol-Myers gets $1.6 billion offer for French consumer health unit,"Volkswagen  said it would take over Volvo's  WirelessCar, a Stockholm-based digital service developer, specializing in connected driving.","Britain's BP has launched the sale of U.S. oil and gas onshore assets that could raise more than $3 billion to help pay for other fields in the United States it bought in October from BHP , industry and banking sources said.",Malaysia on Wednesday charged a second former banker at Goldman Sachs Group Inc  in connection with a suspected money-laundering scheme at state fund 1MDB and said it had issued a summons to the bank.,"SoftBank Corp  shares sank 15 percent on debut, wiping $9 billion off their value, as investors sold off the telecoms operator after its record IPO on worries about a recent service outage and its exposure to Chinese telecoms gear maker Huawei.","Indian drug authorities visited some of Johnson & Johnson's  facilities on Wednesday and took ""tests and samples"" of its talcum powder, the company said in a statement.","Bristol-Myers Squibb Co  received an offer from Japanese healthcare firm Taisho Pharmaceutical Holdings Co Ltd  to buy the company's French over-the-counter drugs business UPSA for $1.6 billion, the companies said on Wednesday."
19,20181220,20181220114137,Trump tariff war with China sends U.S. retailers on buying binge,"In the nearly 40 years she has spent in trade, Amy Magnus has never seen retailers hoarding so much inventory.",World stocks slide as Fed aggravates recession fears,Embraer to pay out $1.6-1.7 billion in extraordinary dividends: paper,"NBCUniversal, Sony Pictures, Warner Bros, Sky offer EU concessions",Fed hikes interest rates,Stocks sink on Fed tightening plans,"Fed lifts rates, sees 'some further' hikes ahead",Amazon error allowed Alexa user to eavesdrop on another home,Tokyo prosecutors appeal after court decides against extending Ghosn detention,"Fed raises interest rates, signals more hikes ahead",China says more trade talks with U.S. planned for January,Airbus tests market for A321XLR jet launch by mid-2019: sources,"Hyundai to open car plant in Indonesia, to build EVs: minister","A user of Amazon's  Alexa voice assistant in Germany got access to more than a thousand recordings from another user because of ""a human error"" by the company.","Tokyo prosecutors have appealed a court decision that prevents further detention of Carlos Ghosn, a surprise ruling which could free the ousted chairman of Nissan Motor Co Ltd for the first time since his arrest for alleged financial misconduct.","After weeks of market volatility and calls by President Donald Trump for the Federal Reserve to stop raising interest rates, the U.S. central bank instead did it again, and stuck by a plan to keep withdrawing support from an economy it views as strong.","China and the United States will hold more talks on trade in January, China said on Thursday, following detailed discussions about the issues to be tacked in the negotiations.","Airbus  is talking to airlines about a longer-range version of its best-selling narrowbody jet family with a view to launching it by mid-2019 as it tries to head off a potential Boeing competitor, people familiar with the matter said.","Hyundai Motor Co  plans to start producing electric vehicles (EVs) in Indonesia as part of an around $880 million auto investment in the country, Industry Deputy Minister Harjanto said on Thursday."
