,date,timestamp,main_title,main_content,feature_title_0,feature_title_1,feature_title_2,video_title_0,video_title_1,video_title_2,stories_title_0,stories_title_1,stories_title_2,stories_title_3,stories_title_4,stories_title_5,stories_content_0,stories_content_1,stories_content_2,stories_content_3,stories_content_4,stories_content_5
10,20190811,20190811103216,Mexican banks report failures in processing card payments,Several of Mexico's largest banks reported on Saturday that they were experiencing problems processing debit and credit card payments while some shops in the capital informed customers that they would only accept cash payments.,Volatility in China's yuan due to escalating U.S. trade friction: PBOC official,Brazil appeals judge lifts temporary arrest of former billionaire Eike Batista,Take Five: The devil's in the data,Week ahead on Wall Street,Wall Street ends wild week with a drop,Stay with equities amid volatility - Miller,Investors look for consumer pressure ahead of next tariffs,Bayer mediator dismisses report of $8 billion Roundup settlement,No Lyft for Uber shares after results fall short,"Trump roils markets with comments on China trade, Huawei",Tame U.S. producer inflation supports case for another rate cut,"Exclusive: PSA, Dongfeng to drop two China auto plants, halve workforce - document","As President Donald Trump prepares to slap new tariffs on Chinese imports, investors are bracing for signs of pressure on U.S. consumers as top retailers begin reporting quarterly results next week and key consumer sentiment and retail sales data is released.","Bayer AG has not offered to pay billions of dollars to settle claims in the United States related to the Roundup herbicide, mediator Ken Feinberg said, dismissing a report to that effect which drove its shares as much as 11% higher.","Shares of Uber Inc fell 10% in early trading on Friday after the ride-hailing service missed most Wall Street targets in its quarterly earnings report, in sharp contrast to upbeat numbers from U.S. rival Lyft Inc a day earlier.","U.S. President Donald Trump on Friday said he was not ready to make a deal with China and even called a September round of trade talks into question, reviving concerns on financial markets that the bilateral dispute is unlikely to end anytime soon.","U.S. producer prices increased moderately in July, lifted by a rebound in the cost of energy products, while underlying producer inflation retreated, which could allow the Federal Reserve to cut interest rates again next month.","Peugeot maker PSA Group  and partner Dongfeng Group  have agreed to cut thousands of jobs in China and drop two of their four shared assembly plants, according to a document seen by Reuters, in a last-ditch bid to curb mounting losses as the world's largest auto market loses steam."
11,20190812,20190812123208,Goldman Sachs economists say fears rise that U.S.-China trade war leading to recession,Goldman Sachs Group Inc  said on Sunday that fears of the  U.S.-China trade war leading to a recession are increasing and that Goldman no longer expects a trade deal between the world's two largest economies before the 2020 U.S. presidential election.,"AMS sparks bidding war for Osram, shines spotlight on auto business","Saudi Aramco aims to buy Reliance stake, reports 12% earnings slide","Stock futures fall on trade war, global growth worries","PSA, Dongfeng to drop two China auto plants, halve workforce - reports",Saudi Aramco still world's most profitable company despite oil price hit,Week ahead on Wall Street,ABB shares jump as new CEO raises turnaround hopes,Nike aims sneaker subscriber scheme at $10 billion U.S. kids market,Fed remains a target as economy falls short of Trump's ambitious goals,BlackRock becomes Authentic Brands' largest shareholder with $875 million stake,Russia tells Google not to advertise 'illegal' events after election protests,Iberdrola to sell 40% stake in UK wind project for 1.6 billion pounds,ABB  shares jumped more than 4% on Monday as investors welcomed news the Swiss engineering group had poached Bjorn Rosengren from Swedish mining equipment firm Sandvik  to be its next chief executive.,Nike Inc will launch a new subscription service for kids sneakers this week that seeks to woo parents with an offer of fewer nightmarish trips to the shoe store in exchange for a regular fee and consistent brand loyalty.,"It has become a jarring and frequent contradiction. President Donald Trump blames the Federal Reserve for putting the U.S. economy at risk while data shows an economy in ""reasonably good"" shape, as the head of the central bank recently said.","BlackRock Inc's  new private equity fund Long Term Private Capital (LTPC) has completed its maiden investment, taking up an $875 million stake in Authentic Brands Group LLC, making it the largest investor in the U.S.-based entertainment company, the fund said on Sunday.","Russia's state communications watchdog has asked Google  to stop advertising ""illegal mass events"" on its YouTube video platform, it said on Sunday.","Spanish energy firm Iberdrola  has agreed to sell a 40% share in British offshore wind project East Anglia One to the Green Investment Group, it said on Monday."
12,20190813,20190813120546,Exclusive: Google's jobs search draws antitrust complaints from rivals,"Google's fast-growing tool for searching job listings has been a boon for employers and job boards starving for candidates, but several rival job-finding services contend anti-competitive behavior has fueled its rise and cost them users and profits.","Futures slide amid geopolitical tensions, trade worries","As Barneys struggles, fashion vendors try on alternative channels",African Americans underserved by U.S. banks: study,"Markets jolted by Hong Kong unrest, Argentine peso crash",TUI earnings hurt by 737 MAX grounding,Geopolitical worries sink stocks,"Exclusive: Yuan at right level, disorderly capital flows unlikely - China central bank official",Austria's AMS says looking forward to discussions with Osram,"Exclusive: Citgo chooses new CEO to navigate political, legal turmoil - sources",European blockchain company Bitfury launches artificial intelligence unit,U.S. senators ask Amazon CEO if 'Amazon's Choice' deceives consumers,"Oil drops on demand concerns, rising U.S. shale output","China's yuan is at an appropriate level currently and two-way fluctuations in the currency will not necessarily cause disorderly capital flows, a senior official at the People's Bank of China told Reuters on Tuesday.",Sensor specialist AMS   on Tuesday said it took note of Osram's willingness to discuss a takeover and was looking forward to discussions.,"Citgo Petroleum Corp has selected Carlos Jorda as its next chief executive, according to three people familiar with the matter, turning to a seasoned refinery expert and native Venezuelan to run a company facing legal attacks and working under U.S. sanctions against parent Petroleos de Venezuela (PDVSA).","European blockchain company The Bitfury Group, valued recently at more than $1 billion, has launched its artificial intelligence (AI) division, the company's top official told Reuters in an interview.","Two U.S. senators asked Amazon.com Inc Chief Executive Jeff Bezos on Monday how the ""Amazon's Choice"" badge on certain products is determined and whether the mark deceives consumers into purchasing ""products of inferior quality.""",Oil prices dropped on Tuesday after see-sawing throughout the session as lingering concerns over global demand and rising U.S. output offset expectations for major producers to further curtail supply.
13,20190814,20190814112457,"CBS, Viacom reunite with plans for bigger role in streaming TV wars","CBS Corp  and Viacom Inc  have reached a deal to reunite media mogul Sumner Redstone's U.S. entertainment empire, betting that a larger company will be able to compete and partner better in a media industry dominated by giants.",Exclusive: Google's jobs search draws antitrust complaints from rivals,"China's economy worsens in July, industrial growth at 17-year low as trade war escalates",Global stocks take fright as recession warnings grow,"No-deal Brexit will be stopped, Hammond says","Global economy: Germany shrinks, China worsens",CBS and Viacom are getting back together again,U.S. aviation regulator bans select MacBook Pro laptops from flights,"Trump delays tariffs on Chinese cellphones, laptops, toys; markets jump","Anbang's Japan properties up for sale, Blackstone seen bidding: sources","Lower fees, snazzy branches: Hong Kong banks gird for online-only onslaught",Air Canada sees A220 jet delivering boost for key U.S. transit traffic,Lion Air 'urgently requires' more 737 MAX jets to support growth: co-founder,"U.S. Federal Aviation Administration (FAA) has banned certain models of Apple Inc's  MacBook Pro laptops on flights, after the company recalled select units which had batteries posing fire risks.","U.S. President Donald Trump on Tuesday backed off his Sept. 1 deadline for 10% tariffs on remaining Chinese imports, delaying duties on cellphones, laptops and other consumer goods, in the hopes of blunting their impact on U.S. holiday sales.","China's troubled Anbang Insurance Group has put its $2.4 billion property portfolio in Japan up for sale and previous owner Blackstone Group  is bidding, two people familiar with the company's plans said.","Hong Kong's biggest banks are set to cut fees, boost digital services and jazz up branches with features such as touch-screen display panels to meet competition from new online-only lenders in one of the world's most profitable banking markets.","Air Canada said on Wednesday it will launch a direct Seattle-Montreal service next spring with its new A220-300 jets, as the carrier eyes new routes to grow its share of lucrative international transit traffic to and from the United States.","Indonesia's Lion Air ""urgently requires"" more Boeing Co  737 MAX jets to support its growth strategy once regulators approve the grounded model's return to service, the airline's co-founder, Rusdi Kirana, told Reuters on Wednesday."
14,20190815,20190815114640,Boeing delays delivery of ultra-long-range version of 777X,"Boeing Co  has pushed back the entry into service of an ultra-long-range version of its forthcoming 777X widebody, the U.S. planemaker said on Wednesday, as it grapples with fallout from the 737 MAX crisis and engine issues with the 777X.",China's trade threats deal fresh blow to world stocks,"Markets register a shock, but is Trump right to blame the Fed?","Bitcoin slumps to two-week low on technical trading, market jitters",Maersk warns trade war could hurt shipping,"Carlsberg fizzes on Asia, premium beers",Two pilots fired over HK protests - Cathay Pacific,China says it must take counter-measures to latest U.S. tariffs,Walmart raises earnings forecast for year after jump in quarterly sales,"Alibaba results beat estimates on cloud, e-commerce growth",Microsoft's latest privacy policy says vendors listen to voice data,"Buffett's Berkshire boosts Amazon.com bet, attracts Ackman","Mastercard, Indonesia's Artajasa to collaborate on payment gateway","China has to take necessary counter-measures to the latest U.S.  tariffs on $300 billion of Chinese goods, the finance ministry said on Thursday.","U.S. retailer Walmart Inc  reported an estimate-beating jump in second-quarter U.S. comparable sales on Thursday as shoppers boosted purchases at its stores and websites, sending its shares up 5% in premarket trading.","China's Alibaba Group Holding Ltd  reported better- than-expected quarterly revenue and profit on Thursday, aided by growth in its e-commerce and cloud computing businesses.",Microsoft Corp  said on Wednesday it updated its privacy policy to let customers know that it had been collecting voice data of its users with the help of employees and contractors.,"Warren Buffett's Berkshire Hathaway Inc  on Wednesday said it boosted its stake in Amazon.com Inc  by 11% during the second quarter, increasing its bet on the powerful online retailer even as stocks traded near record highs.",Mastercard Inc  said on Thursday it signed an agreement with Indonesian payment switching firm Artajasa Pembayaran Elektronis to make a foray into the Southeast Asian country's national payment gateway system.
15,20190816,20190816124852,Trump says China talks 'productive'; Beijing vows tariff retaliation,"U.S. President Donald Trump said on Thursday that U.S. and Chinese negotiators were holding ""productive"" trade talks and expected them to meet in September despite U.S. tariffs on over $125 billion worth of Chinese imports taking effect Sept 1.","Alibaba and the $15 billion question: Amid Hong Kong's protests, when to list?","Futures climb on stimulus hopes, Nvidia results","'Crazy inverted yield curve' vexes Fed, with no clear resolution",Argentine peso jumps after heavy losses,S&P; 500 could sink to December lows - Gabriel,"Dow, S&P; rise on strong retail data",Facebook failed to warn users of known risks before 2018 breach: court filing,U.S. surfboard makers not so stoked about China tariffs,Invesco thrives in China as former executive Ross leads Trump's trade war,Deere trims earnings forecast on trade war woes,"Irish regulator nears end of first privacy probe, ruling to take months",Weight of history: Chongqing Steel and China's state sector dilemma,"Facebook  users suing the world's largest social media network over a 2018 data breach say it failed to warn them about risks tied to its single sign-on tool, even though it protected its employees, a court filing on Thursday showed.","President Donald Trump's decision to slap 10% tariffs on  imported surfboards convinced surf executive Sue Bowers to move  factory jobs out of China - but not back to the United States, which was one goal of Trump's tariffs.","The former investment company of U.S. Commerce Secretary Wilbur Ross has been flourishing in China, even as he marshals billions of dollars' worth of punishing tariffs in America's deepening trade war.","Deere & Co.'s  third-quarter earnings on Friday missed Wall Street estimates, hurt by the U.S.-China trade war that has dented the demand for its farm machines, forcing the company to revise down its full-year profit and sales growth forecasts.","Ireland's data privacy regulator is close to concluding its first probe into a multinational company under the EU's new privacy laws, likely to involve Facebook's WhatsApp subsidiary, although a formal decision could take months.","A year and a half ago, Chongqing Iron and Steel Corp (CISC) , China's oldest steelmaker, was rescued from the brink of bankruptcy in a deal hailed as a shining example of how struggling state companies can be revamped."
16,20190817,20190817122948,Exclusive: U.S. set to give Huawei another 90 days to buy from American suppliers - sources,"The U.S. Commerce Department is expected to extend a reprieve given to Huawei Technologies that permits the Chinese firm to buy supplies from U.S. companies so that it can service existing customers, two sources familiar with the situation said.",Standard Chartered faces fine for sanctions breaches: Sky News,Amazon.com defeats IRS appeal in U.S. tax dispute,"U.S. removes some Chinese furniture, modems from planned 10% tariffs",Week ahead on Wall Street,Wall Street rises on stimulus optimism,Potential recession may be mild - Kamen,Airbnb records 30% growth rate in first-quarter on booking strength: source,Court leaves PG&E; with sole right to submit bankruptcy plan,U.S. housing market mired in weakness; consumer sentiment ebbs,"Wall Street Week Ahead: Lower rates could boost housing stocks, but risks remain","U.S. judge urges VW, SEC to resolve civil Dieselgate suit",Rental firm walks away from Tesla order after quality dispute,"Airbnb Inc recorded $9.4 billion in total booking value in the first quarter, up 31% from the year-ago quarter, a source familiar with the matter said on Friday, a key number that could help pull in investors as the home-sharing company plans its foray into the public market.","A federal judge on Friday allowed PG&E; Corp to retain the sole rights to propose a plan to exit bankruptcy, as he rejected efforts by investors to put forward competing plans, according to court documents.","U.S. homebuilding fell for a third straight month in July amid a steep decline in the construction of multi-family housing units, but a jump in permits to a seven-month high offered hope for the struggling housing market.","Lower U.S. interest rates could help support outperforming U.S. homebuilder stocks, even as they raise worries about the economy, while a bonanza of industry data and Federal Reserve speakers next week are likely to help shape the outlook.",A federal judge in California on Friday urged the U.S. Securities and Exchange Commission and Volkswagen AG  to resolve a civil suit stemming from its Dieselgate emissions scandal.,"Car rental company Nextmove has walked away from a 5 million euros ($5.55 million) order for 85 Tesla  Model 3 electric vehicles following a dispute over how to fix quality issues, the German company said on Friday."
17,20190818,20190818105753,Exclusive: U.S. set to give Huawei another 90 days to buy from American suppliers - sources,"The U.S. Commerce Department is expected to extend a reprieve given to Huawei Technologies that permits the Chinese firm to buy supplies from U.S. companies so that it can service existing customers, two sources familiar with the situation said.","Argentina Treasury minister resigns, says 'significant renewal' needed amid economic crisis","Ferrari will expand its lineup of road cars, but not too much",Last orders: Rise of closing auctions stirs worries in European stock markets,U.S. expected to extend Huawei deadline - sources,Week ahead on Wall Street,Wall Street rises on stimulus optimism,SoftBank plans to lend up to $20 billion to employees to invest in new fund: WSJ,"Wall Street Week Ahead: Lower rates could boost housing stocks, but risks remain",Amazon.com defeats IRS appeal in U.S. tax dispute,"U.S. removes some Chinese furniture, modems from planned 10% tariffs",Standard Chartered faces fine for sanctions breaches: Sky News,Sainsbury's says not talking to internal candidates for CEO succession,"Japan's SoftBank Group Corp  is planning to lend up to $20 billion to its employees, including Chief Executive Masayoshi Son, to buy stakes in its second Vision Fund, the Wall Street Journal reported https://on.wsj.com/307Ljih on Saturday, citing people familiar with the matter.","Lower U.S. interest rates could help support outperforming U.S. homebuilder stocks, even as they raise worries about the economy, while a bonanza of industry data and Federal Reserve speakers next week are likely to help shape the outlook.",Amazon.com Inc on Friday defeated an appeal by the U.S. Internal Revenue Service in what the online retailer has called a $1.5 billion dispute over its tax treatment of transactions with a Luxembourg subsidiary.,"The Trump administration is sparing some Chinese-made household furniture, baby items and internet modems and routers from its next rounds of 10% tariffs, it said on Friday.","Banking group Standard Chartered  is facing a fine for failing to prevent sanctions breaches, Sky News reported on Saturday.","Sainsbury's  is not talking to internal candidates about succession plans to Chief Executive Officer Mike Coupe and he has the full support of company's shareholders and the board, a company spokesperson told Reuters late on Saturday."
18,20190819,20190819105723,"Trump 'not ready' for China trade deal, dismisses recession fears","U.S. President Donald Trump and top White House officials dismissed concerns that economic growth may be faltering, saying on Sunday they saw little risk of recession despite a volatile week on global bond markets, and insisting their trade war with China was doing no damage to the United States.","Exclusive: Fearing data privacy issues, Google cuts some Android phone data for wireless carriers",U.S. President Trump does not want to do business with China's Huawei,"Apple CEO warns Trump about China tariffs, Samsung competition",U.S. expected to extend Huawei deadline - sources,Week ahead on Wall Street,Wall Street rises on stimulus optimism,"Stimulus hopes support stocks, ease pressure on bonds","Microsoft, Nvidia team up for more realistic visuals on Minecraft game",Novartis to answer U.S. Senate demand for data manipulation details,JPMorgan to brief clients on volatility in equity markets,U.S. whiskey exporters struggle after year of EU tariffs,Juul raises $325 million in equity and debt financing,"Global equity markets rose on Monday on signs that major economies would look to prop up stalling growth with fresh stimulus measures, easing pressure on bonds and dampening demand for perceived safe-havens such as gold.",Microsoft Corp  said on Monday it will use chipmaker Nvidia Corp's  real-time ray tracing technology to provide the software company's Minecraft video game players more realistic graphics on personal computers.,"Novartis  plans to answer a U.S. senator who demanded details about data manipulation related to its gene therapy Zolgensma, amid scrutiny of the Swiss drugmaker's decision to delay informing regulators until after the treatment's approval.","JPMorgan Chase & Co  plans to host a conference call for clients on Tuesday to address recent market moves, after last week's inversion of the U.S. Treasury yield curve and a sharp sell-off on global stock markets.","When Europe's tariffs on U.S. whiskey hit in June 2018, craft distillery Mountain Laurel Spirits LLC lost 10% of its sales overnight as its European distributor simply stopped buying its award-winning Dad's Hat Pennsylvania Rye Whiskey.","E-cigarette maker Juul Labs Inc has raised $325 million in an equity and debt offering, a regulatory filing showed on Monday, as the company looks to speed up its global expansion at a time it is facing growing U.S. regulatory scrutiny."
19,20190820,20190820113404,Humbled Deutsche Bank faces battle in its own backyard,Online retailer Zalando is just the kind of fast-growing German business with foreign expansion plans that Deutsche Bank Chief Executive Christian Sewing needs to help drive the struggling lender's recovery.,Climate change could rain on Saudi Aramco's IPO parade,Exclusive: WhatsApp in talks to launch mobile payments in Indonesia - sources,Huawei founder details 'battle mode' reform plan to beat U.S. crisis,"European shares gain for third straight session, AstraZeneca boosts","Facebook, Twitter spot fake posts on HK protests",Top CEOs pledge to put employees before profits,"U.S. yield curve: Invert, steepen, repeat",Stocks futures subdued after strong rebound on stimulus hopes,Elanco to buy Bayer's animal health unit for $7.6 billion,Lufthansa will hold its ground in short-haul price war: CEO,Top U.S. CEOs say companies should put social responsibility above profit,Kohl's quarterly profit beat lifts shares even as sales dip,A swift steepening of the U.S. 2-year/10-year yield curve after it inverted last week may have given investors hope that the United States can escape recession. They should probably take a breath.,U.S. stock index futures treaded water on Tuesday as investors paused after a three-day run that was driven by hopes that major economies would act to counter a global economic downturn.,"Elanco Animal Health  said on Tuesday it would buy Bayer's  veterinary drugs unit in a cash and stock deal valued at $7.6 billion, creating the second largest animal health business and expanding Elanco's reach in the pet e-commerce space.","German carrier Lufthansa  will continue to fight for market share in the hotly contested market for short-haul flights, where it is determined to compete with budget airlines such as Ryanair , its chief executive said.","Corporate America is responsible for providing economic benefits to all, not just its investors, the Business Roundtable group said on Monday.",Department store operator Kohl's Corp  reported better-than-expected quarterly profit and revenue on Tuesday and said it expects to benefit from newer partnerships and the expansion of its Amazon returns program in the second half of the year.
