,date,timestamp,main_title,main_content,feature_title_0,feature_title_1,feature_title_2,video_title_0,video_title_1,video_title_2,stories_title_0,stories_title_1,stories_title_2,stories_title_3,stories_title_4,stories_title_5,stories_content_0,stories_content_1,stories_content_2,stories_content_3,stories_content_4,stories_content_5
20,20200121,20200121130310,Exclusive: Apple dropped plan for encrypting backups after FBI complained - sources,"Apple Inc  dropped plans to let iPhone users fully encrypt backups of their devices in the company's iCloud service after the FBI complained that the move would harm investigations, six sources familiar with the matter told Reuters.",Huawei CFO's legal team to contest U.S. extradition in day 2 of Canada hearing,Apple lawsuit tests if an employee can plan rival startup while on payroll,Boeing plans to stage first flight of 777X plane this week: sources,"America's relationship with China ""probably never been better"" - Trump",Thunberg: Pretty much nothing has been done to reduce CO2 emissions,China virus fear slams European shares,China virus sends shiver through markets as risks mount,EU decision on LSE-Refinitiv deal expected in a few months: LSE director,Uber cuts losses from Eats business in India with sale to Zomato,"Facebook targets UK growth with 1,000 hires this year",Halliburton beats estimate on international demand; takes $2.2 billion charge,BP appoints new finance chief as Looney prepares to take over,"Global shares took a beating on Tuesday, wiping out all gains made at the start of the week as mounting concerns about a new strain of coronavirus in China sent a ripple of risk aversion through markets.","European competition authorities are expected to rule on the London Stock Exchange's $27 billion takeover of data and analytics company Refinitiv ""around the summer"", an LSE board member said on Tuesday.",Uber  has sold its loss-making online food-ordering business in India to local rival Zomato in exchange for a 9.99% stake in the startup backed by China's Ant Financial.,"Facebook will hire 1,000 people in London this year in roles such as product development and safety as it continues to grow its biggest engineering center outside the United States after Britain leaves the European Union.","Halliburton Co beat analysts' estimates for quarterly profit on Tuesday, as higher drilling activity in international markets helped the oilfield services provider blunt a hit from slowing North America that led to a charge of $2.2 billion.",BP's  finance chief Brian Gilvary is to step down in June after eight years in the role and will be replaced by a close ally of Bernard Looney who takes over as chief executive next month.
21,20200122,20200122115044,Exclusive: Bank of America to hire 50 bankers for Asia dealmaking team in 2020 - sources,"Bank of America Corp  will recruit about 50 bankers for its investment banking team in Asia this year, as it pushes to bolster its dealmaking business and shore up revenues from the unit, three people with direct knowledge of the matter said.",Tesla crosses $100 billion stock market valuation in extended trading,Canadian prosecutor set to defend U.S. request to extradite Huawei CFO Meng,Johnson & Johnson quarterly profit jumps 32%,Volocopter air taxi fleet ready by 2022 -CEO,Ex-Vale CEO charged with homicide for dam disaster,Netflix U.S. growth sputters in face of rivals,"Stocks shake off China virus worries, dollar gains","Google CEO eyes major opportunity in healthcare, says will protect privacy",Activist hedge fund Elliott sells stakes in Hyundai Motor companies: paper,Renault chairman hopes decision on new CEO is made 'in coming days',Latest 737 MAX delay prompts big buyer flydubai to consider leasing options,"BlackRock, partners eye initial $500 million for climate fund","World stock markets looked to be getting back to full strength on Wednesday, as updates from China about the spread of a new flu-like coronavirus raised hopes the outbreak would be contained.","Sundar Pichai, the CEO of Alphabet Inc and its Google subsidiary, said on Wednesday that healthcare offers the biggest potential over the next five to 10 years for using artificial intelligence to improve outcomes, and vowed that the technology giant will heed privacy concerns.","Elliott Management sold all its shares in Hyundai Motor Group companies last year, a South Korean newspaper reported on Wednesday, after the U.S. activist hedge fund's campaign demanding 7 trillion won ($6 billion) in dividends and board seats was thwarted in March.","Renault  Chairman Jean-Dominique Senard said Wednesday he hoped the decision on the French carmaker's new CEO would be made in ""the coming days"".","Airline flydubai, a major Boeing  737 MAX customer, is considering leasing additional aircraft following the latest setback to the grounded jet's return to service.",A BlackRock-backed  group aims to raise an initial $500 million for a private equity fund that will invest in climate change-linked infrastructure upgrades in emerging markets.
22,20200123,20200123084023,Amazon asks court to pause Microsoft's work on Pentagon's JEDI contract,Amazon.com Inc said on Wednesday it filed a motion in court to pause the U.S. Department of Defense and Microsoft Corp from carrying out an up to $10 billion cloud computing deal until a court rules on its protest of the contract award.,"Steep losses in China stocks hit Asia, oil tumbles as virus fears grow",ECB to launch review that will redefine its mission and tools,"Britain says Huawei alternatives are limited, decision soon: minister",Tesla tops $100 billion in market valuation,Tech leads S&P; to slight gain,The case for ESG funds: wealth manager,Boeing's new CEO orders rethink on key jetliner project,"U.S. economy to coast, no big boost expected from trade deal: Reuters poll",Google finds security flaws in Apple's web browser: FT,"Oil skids as specter of China virus looms over fuel demand, economy","After China trade deal, Europe and UK next on Trump's to-do list",PG&E; strikes deal with creditors over restructuring,"Boeing Co's  new chief executive has sent the aerospace giant back to the drawing board on proposals for a new mid-market aircraft, effectively shelving in their current form plans worth $15 billion-$20 billion that had been overtaken by the 737 MAX crisis.","The initial trade deal between Washington and Beijing is unlikely to provide a significant boost to the U.S. economy and will only reduce the downside risk or at best help activity moderately, a Reuters poll showed.","Google researchers have found multiple security flaws in Apple Inc's Safari web browser that allowed the tracking of users' browsing behavior, the Financial Times reported on Wednesday, citing a soon-to-be published paper.","Oil prices fell to their lowest in seven weeks on Thursday, sliding more than 1% on concern that the spread of a respiratory virus from China may lower fuel demand if it stunts economic growth in an echo of the SARS epidemic nearly 20 years ago.",U.S. President Donald Trump vowed to rip up international trade deals and rebalance America's global trade relationships.,"Bankrupt California power producer PG&E; Corp  said on Wednesday it had reached a deal on its restructuring with creditors, who were pushing for a rival plan."
23,20200124,20200124100529,Exclusive: Trump to sign USMCA trade deal Wednesday at the White House - source,"U.S. President Donald Trump will sign a trade pact between the United States, Mexico and Canada on Wednesday during a ceremony at the White House, an administration official told Reuters on Thursday.",European stocks shrug off coronavirus fears,Bayer faces fourth U.S. Roundup cancer trial in Monsanto home court,Ericsson hit by higher 5G costs and weaker U.S. market,Davos 2020: Nokia CEO talks 5G revolution,Space travel tourism is a decade from liftoff -UK expert,Travel demand cushions 737 MAX toll,Italy watchdog launches non-compliance proceedings against Facebook,"U.S. to unveil crackdown on counterfeit, pirated e-commerce goods",Nestle teams up with Canadian plant-based ingredients makers,"Oil rises, but potential impact of China virus on fuel demand haunts market",U.S. bank regulator charges ex-Wells Fargo executives for role in sales scandal,Intel signals 2020 will be a turnaround year for chip industry leader,"Italy's competition watchdog has launched proceedings against Facebook for non-compliance with a previous request it had made regarding improper commercial practices in the group's treatment of user data, the agency said on Friday.",The Trump administration plans to unveil efforts on Friday to crack down on counterfeit and pirated goods sold on major e-commerce sites and urge companies to do more to vet third-party sellers and increase self-policing efforts.,"Food group Nestle  has teamed up with Canadian plant-based food ingredient makers Burcon  and Merit to speed up innovation in the fast-growing business segment, it said on Friday.","Oil prices climbed on Friday, following a drawdown in U.S. crude stocks, but were set to fall heavily for the week amid worries that a new coronavirus in China that has killed 25 so far may spread, curbing travel, fuel demand and economic prospects.",Wells Fargo & Co's U.S. regulator on Thursday announced it had banned former Chief Executive John Stumpf from the banking industry and charged him and seven other former executives combined more than $58 million in civil penalties for their roles in the bank's multi-year sales practices scandal.,"Intel Corp  on Thursday cemented the market view that the chip industry is turning around after a prolonged slowdown, forecasting better 2020 revenue and profit than Wall Street anticipated, driven by cloud computing demand."
24,20200125,20200125115717,Owners of solar company that caused loss for Buffett plead guilty over Ponzi scheme,"The husband-and-wife owners of DC Solar, a California solar company that caused Warren Buffett's Berkshire Hathaway Inc  to take a $377 million charge last year, pleaded guilty on Friday to involvement in an estimated $912 million Ponzi scheme.",New U.S. curb on Huawei in limbo amid pushback from Pentagon: sources,"U.S. bank regulator sharpens teeth on Wells Fargo, surprising critics",Explainer: Bezos allegations put phone hacking technology in the spotlight,Weak ahead on Wall Street,Wall Street slides as virus worries mount,Wait for 10% pullback in stocks: fund manager,U.S. senator slams Tesla's 'misleading' name for Autopilot driver assistance system,Financier doubts add to Boeing's MAX headaches,Trump speaks with British PM Johnson about telecoms security: White House,Four-comma club: Predicting the next company to join trillion-dollar value elite,Fiat Chrysler asks U.S. court to toss out GM racketeering claims: filing,U.S. Justice Dept. plans to hold meeting to discuss tech industry liability: sources,"A U.S. senator on Friday urged Tesla Inc  to rebrand its driver assistance system Autopilot, saying it has ""an inherently misleading name"" and is subject to potentially dangerous misuse.","To restore faith in the 737 MAX, Boeing needs to prove its flagship jet is not just airworthy but also a safe investment.","U.S. President Donald Trump on Friday discussed the security of telecommunications networks with British Prime Minister Boris Johnson, the White House said, as Britain nears a decision on Huawei's role in the country's future 5G network.","The trillion-dollar market cap club expanded last week to a third U.S. company, with Google parent Alphabet Inc  topping the lofty valuation mark. Adding the next member, however, is likely to take a while.",Fiat Chrysler Automobiles NV  on Friday urged a federal judge to throw out a General Motors Co's  lawsuit accusing Fiat Chrysler of racketeering and bribing officials of the United Auto Workers union to put GM at a multibillion dollar labor cost disadvantage.,"The U.S. Justice Department is planning to hold a conference to discuss the future of a federal law which largely exempts online platforms from legal liability for the material their users post, sources familiar with the plans said on Friday."
25,20200126,20200126065846,Boeing's 777X jetliner successfully completes maiden flight,"Boeing Co successfully staged the first flight of the world's largest twin-engined jetliner on Saturday in a respite from the crisis over its smallest model, the grounded 737 MAX.",Electric vehicle maker Rivian: expect prices lower than previously announced,Owners of solar company that caused loss for Buffett plead guilty over Ponzi scheme,New U.S. curb on Huawei in limbo amid pushback from Pentagon: sources,Boeing’s 777X takes off on first flight,U.S. Treasury Secretary optimistic on trade deal with UK,Weak ahead on Wall Street,"EU plans more protectionist antitrust rules, data sharing in policy shake-up",Explainer: Bezos allegations put phone hacking technology in the spotlight,U.S. senator slams Tesla's 'misleading' name for Autopilot driver assistance system,Financier doubts add to Boeing's MAX headaches,Fashion retailer H&M; says data protection breaches unacceptable,Walmart testing higher minimum wage for some employees,"The EU plans to adopt more protectionist antitrust rules and encourage businesses to share data as part of an industrial policy overhaul aimed at giving European companies a sharper edge in global markets, a strategy document seen by Reuters shows.",Allegations that Amazon.com boss and Washington Post owner Jeff Bezos had his phone hacked by Saudi Crown Prince Mohammed bin Salman have put a spotlight on the security of smartphones and the secretive tools used to hack them.,"A U.S. senator on Friday urged Tesla Inc  to rebrand its driver assistance system Autopilot, saying it has ""an inherently misleading name"" and is subject to potentially dangerous misuse.","To restore faith in the 737 MAX, Boeing needs to prove its flagship jet is not just airworthy but also a safe investment.",Fashion retailer H&M;  said on Saturday that data security breaches found at its German unit were unacceptable and it was cooperating with the local data protection supervisory authority in its investigation into the matter.,"Walmart Inc is testing a higher starting wage for certain newly created jobs in about 500 U.S. stores, as it looks to improve in-store experience for customers amid intense competition."
26,20200127,20200127063204,"Shares, oil slide as China virus fears intensify; yen, Treasuries in demand","Stocks tumbled on Monday as investors grew increasingly anxious  about the economic impact of China's spreading virus outbreak, with demand spiking for safe-haven assets such as the Japanese yen and Treasury notes.",Exclusive: Regulator probes board role in Credit Suisse spying scandal - sources,WeWork inks office space deal with SoftBank-backed Gympass: sources,Business survey suggests U.S. labor market may have peaked,Boeing’s 777X takes off on first flight,U.S. Treasury Secretary optimistic on trade deal with UK,Weak ahead on Wall Street,"U.S. state AGs, Justice Department officials to meet and coordinate on Google probe: sources",Boeing's 777X jetliner successfully completes maiden flight,"Renault, Nissan chief engineers to meet, revive R&D; projects: sources",Oil extends declines as fears grow over China virus,Tesla's Musk seeks to allay water concerns at factory site after protests,Electric vehicle maker Rivian: expect prices lower than previously announced,"U.S. state attorneys general will meet Justice Department attorneys next week to share information on their investigations into Alphabet Inc's Google, two sources familiar with the matter told Reuters on Sunday. The probes revolve around monopolistic behavior that may harm consumers through Google's control of online advertising markets and search traffic.","Boeing Co successfully staged the first flight of the world's largest twin-engined jetliner on Saturday in a respite from the crisis over its smallest model, the grounded 737 MAX.","Renault's  engineering boss will meet his counterpart at Nissan  in Japan this week, two sources close to Renault said, as the carmakers seek to revive projects crucial to an alliance left reeling by the Carlos Ghosn affair.","Crude prices fell more than 2% to multi-month lows on Monday as the rising number of cases of the new coronavirus in China and city lockdowns there deepened concerns over oil demand, even as Saudi Arabia's energy minister sought to calm the market.","Tesla  Chief Executive Elon Musk sought to allay environmental concerns about the electric carmaker's planned factory in Germany, saying the plant would use less water than was estimated originally.",Electric vehicle startup Rivian on Saturday displayed its pickup truck and SUV at an event in San Francisco's Bay Area and said that when their prices are unveiled soon they will be lower than has been previously announced.
27,20200128,20200128113314,"Airbus agrees to settle corruption probes with U.S., France, UK","Airbus  has agreed in principle to a settlement with French, British and U.S. authorities over an investigation into allegations of bribery and corruption, it said on Tuesday.","At Exxon, CEO's promised turnaround sapped by chemicals, refining",Coronavirus outbreak may disrupt Apple's iPhone production ramp up plans: Nikkei,Renault poised to name VW manager De Meo as CEO: sources,"Airbus agrees to settle corruption probes with U.S., France, UK",U.S. says no new confirmed cases of coronavirus,Wall Street slammed on China virus fears,Selling abates after virus causes worst day since October,Goldman says staff with mainland China exposure should avoid office,Coronavirus infects Asia stocks with exposure to China,Sainsbury's Coupe says exit not due to failure of Asda deal,"Facebook, HSBC and others curb travel to China as warnings grow",Johnson's choice: Britain faces policy test over Huawei 5G role,"European markets rebounded early on Tuesday after the previous day's thumping, which saw investors worried about the economic fallout from the coronavirus outbreak in China huddle in safe-haven assets.","Goldman Sachs  has instructed staff who have been in mainland China to work from home or be out of the office for 14 days since they were last there, according to an internal notice.","Shares of companies highly exposed to China's economy tumbled across Asia on Tuesday on rising concern about the impact of global travel bans associated with a virus outbreak, and even as some stocks involved in preventative health spiked.","The boss of British supermarket group Sainsbury's , Mike Coupe, said he was not stepping down in May because of his failure to buy rival Asda last year.","Facebook Inc  and other global companies including LG Electronics Inc  and HSBC  are restricting travel to China, as the death toll from a flu-like virus rose above 100 on Tuesday.","Prime Minister Boris Johnson will decide if China's Huawei should have a role in Britain's future 5G mobile network on Tuesday, a choice that risks damaging relations with the United States or China on the eve of Brexit."
28,20200129,20200129152230,Boeing swings to annual loss as 737 MAX costs near $19 billion,"Boeing Co on Wednesday swung to its first annual loss since 1997 on mounting 737 MAX costs and indicated it would again cut production of its bigger 787 Dreamliner aircraft, currently its main source of cash.",Explainer: What the U.S. Federal Reserve is watching this year,Apple's iPhone strength is back and analysts say it is here to stay,U.S. banks on Hong Kong Exchange's 'named and shamed' list,BA cancels China flights as airlines step up fight on virus,"Stocks: banks lift Europe, virus fears linger","Apple iPhone back to growth, powering strong earnings","GE beats profit, cash flow estimates on aviation, lower spending",Pompeo to Britain: Look again at Huawei 5G decision,"Goldman unveils long-term targets to grow new businesses, revenues",Shades of Ronaldo; Agnelli heir swoops for soccer star's sunglasses,Warren Buffett gives up on newspapers; Berkshire sells unit to Lee Enterprises,"McDonald's sees higher 2020 spending on tech, R&D; after sales beat","General Electric Co  quarterly profit and cash flow beat analysts' estimates on Wednesday, boosted by its aviation unit, but the industrial conglomerate set a relatively modest profit target for 2020.","The United States on Wednesday urged Britain to rethink its decision to allow China's Huawei a role in 5G networks, cautioning that American information would only be allowed to pass across trusted networks.","Goldman Sachs Group Inc  on Wednesday set aggressive targets to grow many of its businesses, as the Wall Street powerhouse tries to make meaningful inroads in areas dominated by larger rivals JPMorgan Chase  and Bank of America",Luxury eyewear group Italia Independent  is hoping to borrow some of Cristiano Ronaldo's star appeal.,"Warren Buffett's Berkshire Hathaway Inc  agreed to sell its newspaper business to Lee Enterprises Inc  for $140 million in cash, abandoning an industry the billionaire investor had long defended even as its financial prospects deteriorated.","McDonald's Corp  beat forecasts with its quarterly sales on Wednesday and said it would spend more on technology and research in 2020, as the world's largest burger chain bets on revamped stores and menu additions to lure more diners and gain market share."
29,20200130,20200130085207,"Facebook warns revenue growth slowing, costs remain high","Facebook Inc  said on Wednesday that growth would continue to slow as its business matured and it reported a surge in quarterly expenses, disappointing Wall Street expectations that the costs of improving privacy would level off.","Microsoft cloud revenue regains momentum, sending profit above Street estimates","Fears of pandemic send stocks lower, safe havens in demand",Bayer considering stopping sales of glyphosate to private users: newspaper,Victoria's Secret may be up for sale,Fed keeps rates steady while monitoring coronavirus,"Tesla, Microsoft, Facebook earnings roundup",Sweden's AB Volvo plans big shareholder payout as profit beats,U.S. economy growing moderately in fourth quarter; likely missed Trump's 3% goal in 2019,"Japan issues arrest warrants for ex-U.S. soldier, two others for Ghosn escape",Frankfurt out of running for German auto show from 2021,"U.S. refiners, chemical makers pare insurance coverage as accidents boost costs",Policymakers fret over global growth risks from China virus outbreak,Swedish truck maker AB Volvo  reported a smaller than expected fall in fourth-quarter earnings in the face of slowing demand and announced plans on Thursday for a payout to shareholders that exceeded market expectations.,"The U.S. economy likely maintained a moderate pace of growth in the fourth quarter, and probably again fell short of attaining the Trump administration's coveted but elusive 3% annual growth target because of slumping business investment amid damaging trade tensions.",Japanese authorities on Thursday issued arrest warrants for a former U.S. special forces soldier and two other men on suspicion of smuggling former Nissan Motor Co  boss Carlos Ghosn out of Japan.,"Frankfurt will no longer host the German auto show from 2021 after almost 70 years as the home of the annual exhibition of the industry's latest innovations, the VDA auto association said late on Wednesday.","U.S. refineries and petrochemical plants are cutting back on insurance because several years of severe accidents have driven up the cost of coverage, industry and insurance sources said.","A rapidly spreading virus outbreak in China is emerging as a potentially major new risk to the global economy and leaving policymakers, still grappling with the impact of the Sino-U.S. trade war, fretting over the widening fallout."
