,date,timestamp,main_title,main_content,feature_title_0,feature_title_1,feature_title_2,video_title_0,video_title_1,video_title_2,stories_title_0,stories_title_1,stories_title_2,stories_title_3,stories_title_4,stories_title_5,stories_content_0,stories_content_1,stories_content_2,stories_content_3,stories_content_4,stories_content_5
20,20200521,20200521110508,"Backlogs, second wave of layoffs keeping U.S. weekly jobless claims high","Millions more Americans likely filed for unemployment benefits last week as backlogs continue to be cleared and disruptions from the novel coronavirus unleash a second wave of layoffs, pointing to another month of staggering job losses in May.","While U.S. economy slides, heartland auto dealers cry out for more trucks",Lufthansa closes in on $10 billion state rescue deal,SoftBank to sell $3.1 billion worth of Japan telco unit stake,Lufthansa nears bailout; EasyJet gets ready to fly,AstraZeneca to make billion COVID vaccine doses if tests succeed,Gap ramps up robot workforce for online sales,Futures retreat as trade tensions add to pandemic woes,Traders Beware: U.S. taps new tools to find fraud in volatile commodities market,"In SoftBank slides, tofu, a goose and unicorns underpin sales pitch",Wanted: New head of WTO. Must thrive under global pressure and conflict,Gap rushes in more robots to warehouses to solve virus disruption,Japan to seek extradition of men arrested in U.S. over Ghosn escape,U.S. stock index futures fell on Thursday as growing trade tensions with China added to worries about the pace of a recovery from a coronavirus-fueled economic slump even with several countries easing lockdowns.,"When the U.S. Department of Justice charged a handful of JP Morgan Chase & Co  traders in 2018 and 2019 with alleged commodities futures manipulation, it wasn't the first time the government had probed the bank's metals trading activities.","A chastened Masayoshi Son summed up SoftBank Group Corp's  record $13 billion operating loss on stage this week with a striking image: unicorns tumbling into the ""valley of the coronavirus"".","Against the backdrop of a global pandemic, steep recession, intensifying U.S-China tensions and rising protectionism, the WTO needs to name a leader. Only the resilient should apply.","U.S. apparel chain Gap Inc is speeding up its rollout of warehouse robots for assembling online orders so it can limit human contact during the coronavirus pandemic, the company told Reuters.",Japan said on Thursday it was working to secure the rapid extradition of two men arrested in the United States on charges of enabling the dramatic escape of former Nissan Motor Co boss Carlos Ghosn from the country.
21,20200522,20200522115604,U.S. strikes at a Huawei prize: chip juggernaut HiSilicon,The latest U.S. government action against China's Huawei takes direct aim at the company's HiSilicon chip division -- a business that in a few short years has become central to China's ambitions in semiconductor technology but will now lose access to tools that are central to its success.,GM gradually restarts in Mexico as Lear Corp readies for return,"Rudderless after a rally, stock markets look for next catalyst",Wall Street Week Ahead: Investors look beyond drug makers as hunt for Covid-19 treatment heats up,UK borrowing soars to record; retail sales slump,China ditches GDP target for first time,Facebook to permanently embrace remote work,"Nissan considering 20,000 job cuts, mainly in Europe, developing nations: Kyodo",Futures retreat as Sino-U.S. tensions simmer,"With remote work plan, Facebook dashes hopes of paycheck arbitrage",France warns Renault could disappear; Nissan plans job cuts,"Alibaba revenue, profit beat as online sales surge during lockdown",Deere sees sharp fall in annual profit as lockdowns sap demand,"Nissan Motor Co  is considering cutting 20,000 jobs from its global workforce, focusing on Europe and developing countries, Kyodo news reported on Friday, as the Japanese automaker struggles to recover from plunging car sales.",U.S. stock index futures retreated on Friday as growing tensions between Washington and Beijing added to fears of a slower recovery from a coronavirus-led recession.,"With Facebook's adoption of permanent remote work on Thursday, Chief Executive Mark Zuckerberg has untethered one of Silicon Valley's biggest companies from the place that incubated it.","Europe's car industry was put on alert for more job losses on Friday as a French minister warned Renault could disappear if it didn't get help soon and a Japanese news report said partner Nissan was considering 20,000 layoffs, with many in Europe.","China's Alibaba Group Holding Ltd  reported better-than-expected quarterly revenue and profit on Friday, as the COVID-19 lockdowns drove more people to shop online for essentials.","Deere & Co  on Friday forecast a sharp fall in full-year profit as farmers and ranchers struggle to bring their goods to market because of coronavirus-led restrictions, crushing demand for equipment like harvestors and tractors."
22,20200523,20200523115802,Hertz files for U.S. bankruptcy protection as car rentals evaporate in pandemic,The more than a century old car rental firm Hertz Global Holdings Inc  filed for bankruptcy protection on Friday after its business was decimated during the coronavirus pandemic and talks with creditors failed to result in much needed relief.,Dozens of Chinese companies added to U.S. blacklist in latest Beijing rebuke,U.S. grants tentative OK for 15 air carriers to suspend service to 75 airports,Large employers push back on U.S. healthcare mergers during coronavirus crisis,Stocks end mixed ahead of partial NYSE reopen,"COVID-19, not China, will drive markets: advisor",Drug touted by Trump as COVID-19 treatment tied to higher death risk,Uber customer claims company won price-fixing suit because arbitrator was scared,"Kuehne+Nagel owner sees about 20,000 job cuts: Die Welt",Business groups push Trump to keep skilled-worker visas amid pandemic,Wall Street Week Ahead: Investors look beyond drug makers as hunt for COVID-19 treatment heats up,U.S. agencies ask FCC to rescind Ligado spectrum decision,Automaker trade backs U.S. on effort to weaken fuel efficiency rules,"An Uber customer on Friday asked a Manhattan federal judge to overturn an arbitration win for the company in a price-fixing case, arguing that the arbitrator only ruled in Uber's favor because he was scared.","Freight-forwarder Kuehne+Nagel  may cut more than 20,000 jobs, with warehouse workers most affected, as the coronavirus-caused economic crisis hits shipping, controlling shareholder Klaus-Michael Kuehne said in an interview.","A range of business groups have made an 11th-hour appeal to U.S. President Donald Trump as he weighs whether to restrict temporary work visas, warning of negative economic consequences if he blocks the flow of skilled foreign workers into the United States.","Investors are diversifying bets in the healthcare sector, as the rush to develop treatments for Covid-19 has driven up prices for some pharmaceutical stocks.","A group of U.S. agencies on Friday asked the Federal Communications Commission (FCC) to reconsider its unanimous April 22 decision to allow Ligado Networks [MOSAV.UL] to deploy a low-power nationwide mobile broadband network, saying it could pose a threat to global positioning systems (GPS).",A group representing many major automakers on Friday backed the Trump administration's decision to weaken Obama administration fuel efficiency standards but said it opposed further reductions in requirements.
23,20200524,20200524113215,Hertz files for U.S. bankruptcy protection as car rentals evaporate in pandemic,The more than a century old car rental firm Hertz Global Holdings Inc filed for bankruptcy protection on Friday after its business was decimated during the coronavirus pandemic and talks with creditors failed to result in much needed relief.,Dozens of Chinese companies added to U.S. blacklist in latest Beijing rebuke,U.S. grants tentative OK for 15 air carriers to suspend service to 75 airports,Large employers push back on U.S. healthcare mergers during coronavirus crisis,Hertz files for bankruptcy protection,Drug touted by Trump as COVID-19 treatment tied to higher death risk,Americans bulk up on home gym equipment to stay fit while staying at home,Uber customer claims company won price-fixing suit because arbitrator was scared,"Kuehne+Nagel owner sees about 20,000 job cuts: Die Welt",Lufthansa to resume flights to 20 destinations from mid-June,Business groups push Trump to keep skilled-worker visas amid pandemic,Wall Street Week Ahead: Investors look beyond drug makers as hunt for COVID-19 treatment heats up,Jaguar seeks state loan as coronavirus pandemic takes toll: Sky News,"An Uber customer on Friday asked a Manhattan federal judge to overturn an arbitration win for the company in a price-fixing case, arguing that the arbitrator only ruled in Uber's favor because he was scared.","Freight-forwarder Kuehne+Nagel  may cut more than 20,000 jobs, with warehouse workers most affected, as the coronavirus-caused economic crisis hits shipping, controlling shareholder Klaus-Michael Kuehne said in an interview.","Lufthansa , which is in talks with the German government over a 9 billion euro ($9.8 billion) bailout, will resume flights to 20 destinations from mid-June, including some holiday hot-spots, a spokeswoman said on Sunday.","A range of business groups have made an 11th-hour appeal to U.S. President Donald Trump as he weighs whether to restrict temporary work visas, warning of negative economic consequences if he blocks the flow of skilled foreign workers into the United States.","Investors are diversifying bets in the healthcare sector, as the rush to develop treatments for Covid-19 has driven up prices for some pharmaceutical stocks.","Jaguar Land Rover  is in talks with the British government about a request for temporary state funding of more than 1 billion pounds ($1.22 billion), Sky News said on Saturday, a report the company said was inaccurate."
24,20200525,20200525112555,Stocks gain as German survey fuels optimism; dollar firm,"Stocks edged higher on Monday after a survey showed German business morale rebounded in May, boosting optimism around economic re-openings, although caution prompted the dollar to snap a rare losing streak.",VW loses landmark German case as diesel owners stand to receive damages,Most publicly listed companies keep U.S. small-business aid loans,Hertz files for U.S. bankruptcy protection as car rentals evaporate in pandemic,Japan seeks to end Tokyo's state of emergency,Aston Martin chief to be replaced: Source,Hertz files for bankruptcy protection,Dozens of Chinese companies added to U.S. blacklist in latest Beijing rebuke,U.S. grants tentative OK for 15 air carriers to suspend service to 75 airports,Large employers push back on U.S. healthcare mergers during coronavirus crisis,Investing in Spanish Nissan factory cheaper than closing it: Spanish official,"Aston Martin chief to leave, Mercedes-AMG CEO to replace him: source","Lufthansa, German government agree on rescue package: source",The United States said on Friday it would add 33 Chinese firms and institutions to an economic blacklist for helping Beijing spy on its minority Uighur population or because of ties to weapons of mass destruction and China's military.,The U.S. Transportation Department said late on Friday it had granted tentative approval to 15 airlines to temporarily halt service to 75 U.S. airports because of the coronavirus pandemic.,A group representing some of the largest U.S. employers has asked Congress for a year-long ban on mergers and acquisitions among hospitals and doctors groups that received government money to cope with the effects of the COVID-19 pandemic.,"Nissan Motor  would find it cheaper to invest in its Barcelona factory than to close it, a senior Spanish industry ministry official said on Monday, pegging the estimated cost of a shutdown at more than 1 billion euros ($1.1 billion).","Aston Martin  Chief Executive Andy Palmer is leaving the business as part of a management shake-up and will be replaced by Tobias Moers, CEO of Mercedes-AMG, a source familiar with the matter told Reuters on Sunday.","The German government and the management of flagship carrier Lufthansa , which has been hit hard by the coronavirus pandemic, have reached an agreement on state aid worth billions of euros, a source close to the matter said."
25,20200526,20200526120724,U.S. small firms leave $150 billion in coronavirus stimulus untapped,"When the U.S. government first rolled out forgivable loans to small businesses in early April under the Paycheck Protection Program, loan officers at Bank of the West in Grapevine, Texas worked nights and weekends to process a tsunami of applications.","S&P; 500 futures surge on recovery, vaccine hopes","Armed with whistleblower tips, U.S. SEC cracks down on coronavirus misconduct",Exclusive: ECB prepares for the worst: life without the Bundesbank - sources,Germany stamps authority on Lufthansa with $9.8 bln lifeline,Japan seeks to end Tokyo's state of emergency,Aston Martin chief to be replaced: Source,'How about next June?' Small meat processors backlogged as virus idles big plants,A Florida toy importer braces for retail upheaval,Sanofi shares down despite $13 billion Regeneron payday,NYSE to reopen trading floor closed by coronavirus,"Demand rise, output cuts could mean oil market balance in June",COVID-19 lawsuit takes on McDonald's like it was a rowdy bar,"Inside the small-scale Iowa abattoir Stanhope Locker and Market, owner Shaunna Zanker yawns with exhaustion as she listens to yet another farmer asking her to slaughter his pigs.","Most U.S. states have begun to reopen their economies, but Jay Foreman, chief executive of Basic Fun, said he's more worried than ever.",Shares in Sanofi  fell on Tuesday despite the French drugmaker's impending $13 billion payday from selling most of its 20.6% stake in U.S. partner Regeneron .,The New York Stock Exchange will partially reopen the trading floors at its iconic 11 Wall Street building on Tuesday for the first time since March 20 when the bourse was forced to go all-electronic due to the coronavirus pandemic.,"Recovering demand as coronavirus lockdowns ease combined with output cuts by top producers could balance global oil markets as soon as June, some analysts and banks predict.","As U.S. businesses reopen, worried workers and their advocates are borrowing a legal strategy commonly used to shut down rowdy topless bars to try and force employers to strengthen protection against further spread of the coronavirus."
26,20200527,20200527102116,Huawei Meng's U.S. extradition case hinges on key ruling in Canada on Wednesday,"A Canadian judge will rule Wednesday on a key aspect of Huawei Technologies Chief Financial Officer Meng Wanzhou's extradition to the United States, with a favourable judgment seen as paving the way for the release of the Chinese executive after 18 months of house arrest.",Boeing set to announce significant U.S. job cuts this week: union,Renault and Nissan rule out merger as they unveil survival plan,Tesla cuts prices by as much as 6% in North America to boost demand,Boeing to announce U.S. job cuts this week: union,"Masked traders, Cuomo re-open iconic NYSE",Stocks rally as Merck jumps into vaccine race,Hong Kong unrest worries curb global shares rally,Exclusive: Volkswagen in final talks to seal biggest M&A; deals in China EV sector - sources,Amazon in advanced talks to buy self-driving startup Zoox: WSJ,"Google to start reopening offices, targets 30% capacity in September",Hugo Boss sees recovery in third quarter at earliest,"China's Chery Auto plans to sell cars in EU, United States: chairman","Unrest in Hong Kong over Beijing's proposed national security laws weighed on global shares and oil prices on Wednesday, offsetting optimism about the re-opening of the world economy.","Volkswagen AG  is in final talks to seal its largest investment deals with Chinese electric vehicle (EV) firms, two sources said, as the German automaker accelerates its push into the world's largest market for environmentally friendlier cars.","Amazon.com Inc  is in advanced talks to buy self-driving startup Zoox Inc, in a move that would expand the e-commerce giant's reach in autonomous-vehicle technology, the Wall Street Journal reported https://on.wsj.com/36wXJUV on Tuesday.","Alphabet Inc's Google said on Tuesday it would reopen buildings in more cities at roughly 10% of their capacity beginning July 6 and scale it up to 30% in September, if conditions permit.","Hugo Boss  expects a recovery in its business in the third quarter at the earliest due to store closures and consumer caution during the coronavirus pandemic, the chief executive of German fashion house said on Wednesday.","China's Chery Automobile, which has a manufacturing partnership with Jaguar Land Rover (JLR) , is planning to sell its own-branded cars in the European Union and United States for the first time, its chairman said."
27,20200528,20200528131548,Coronavirus unleashing new wave of U.S. layoffs,The number of Americans filing for unemployment benefits held above 2 million last week for a 10th straight week amid job cuts by U.S. state and local governments whose budgets have been decimated fighting the COVID-19 pandemic and more second-wave layoffs in the private sector.,Exclusive: U.S. taxpayers' virus relief went to firms that avoided U.S. tax,"U.S. firms shield CEO pay as pandemic hits workers, investors","U.S. states, cities may snub Fed lending program over high rates",German economy likely to shrink 6.6% this year,EasyJet cuts jobs; Norwegian Air losses deepen,Minneapolis protests over police killing turn violent,Exclusive: TikTok owner ByteDance moves to shift power out of China - sources,S&P; 500 set for muted open after hitting near 3-month high,"Despite rally, 2020 to be worst year for stocks in nearly a decade: Reuters poll",Trump leapfrogs back ahead of Obama in stock market gains,Home trading triggers bank 'black hole' surveillance alerts,"Amazon to offer permanent roles to 70% of 175,000 new U.S. hires","TikTok's poaching of Disney's Kevin Mayer to be its CEO was just the most visible part of a broader strategy by its Chinese owner to shift its centre of power away from China at a time of rising global tensions, several people familiar with the plans said.",The S&P; 500 looked set for a subdued open on Thursday as investors paused for breath after three days of gains and weighed signs of an economic recovery against underlying tensions between the United States and China.,"This year will be the worst for many world stock markets in nearly a decade at least, although a majority of equity strategists polled by Reuters say top indexes will not revisit lows struck this March following an explosive rally since then.",U.S. President Donald Trump is once again beating predecessor Barack Obama in stock market performance following a stunning recovery on Wall Street.,"Potential breaches of market rules have spiked since traders began working from home in March, drawing scrutiny from regulators and piling pressure on banks to plug ""black holes"" in surveillance systems, industry officials say.","Amazon.com Inc  plans to offer permanent jobs to about 70% of the U.S. workforce it has hired temporarily to meet consumer demand during the coronavirus pandemic, the company told Reuters on Thursday."
28,20200529,20200529104204,"With 'Main Street' in view, Fed weighs risks of job, productivity shocks","U.S. Federal Reserve officials have talked broadly about helping households and firms through the current economic crisis and quickly unleashed trillions of dollars in cash and credit guarantees to build a ""bridge"" to the post-pandemic world.","Travel disruptions, cost cutting key issues for U.S. business in China: report","As lockdowns ease, a Bronx nail salon plans a careful reopening",Trump move could scrap or weaken law that protects social media companies,"Trump blasts twitter fact-check, calls for tougher regulations",Breakingviews TV: Hong Kong hit,TikTok owner ByteDance side-steps China -sources,Global stocks slip as investors await Trump's Hong Kong response,"We thought too big, Renault says as it axes 15,000 jobs in cost-cutting reboot",SoftBank leads $500 million fundraising for Didi's self-driving unit,Japan backs nearly a third of $6.6 billion loans to Nissan: sources,Volkswagen pumps 2 billion euros into China electric vehicle bet,"German official sees Lufthansa bailout in reach, demands fairness","Global stock markets fell and safe havens such as bonds and the Japanese yen gained on Friday, as investors awaited Washington's response to China tightening control over the city of Hong Kong.","Renault acknowledged that its global ambitions had been unrealistic, announcing plans to cut about 15,000 jobs, shrink production and restructure French plants as it pressed the reset button and sought to banish the spectre of Carlos Ghosn.",China's Didi Chuxing said on Friday it had completed a fundraising round of over $500 million for its autonomous driving subsidiary that was led by SoftBank Group's  Vision Fund 2.,"The Japanese government has guaranteed almost a third of the 7l3 billion yen ($6.65 billion) in loans Nissan Motor Co  has secured from its main lenders to weather the COVID-19 pandemic, according to three people with knowledge of the plans.","Volkswagen AG  plans to boost its electric push in China, the world's biggest auto market, by pumping 2.1 billion euros in two Chinese electric vehicle players.","The Berlin government is likely to reach a deal with Brussels on a $10 billion government bailout of stricken airline Lufthansa , senior government official Thomas Jarzombek said on Friday, but stressed the German airline needed fair treatment."
29,20200530,20200530123204,Google postpones Android 11 unveiling amid U.S. protests,Alphabet Inc's  Google on Saturday said it has postponed next week's planned unveiling of the beta version of its latest Android 11 mobile operating system in light of protests and unrest in the United States.,Exclusive: Zoom plans to roll out strong encryption for paying customers,U.S. senators urge probe of TikTok on children's privacy,"Lyft violates Washington DC sick day law during pandemic, lawsuit claims",Stocks end mostly higher on Trump China comments,Vaccines more relevant than China for investors: CIO,Fed's Powell to unemployed: We're here for you,"United Airlines cutting 13 top jobs, adding international flights in July",Wall Street Week Ahead: Investors eye consumer discretionary stocks as U.S. reopens,Lufthansa accepts tweaked demands by Brussels over state bailout,U.S. pipeline operator Energy Transfer warns of coming job cuts,Trump administration to study ways to protect for U.S. investors from Chinese firms,Sale of shut Philly refinery to real estate developer delayed,"United Airlines Holdings Inc  said on Friday it will eliminate 13 officer positions even as it adds international flights back to its network, part of a restructuring to address the hit on its business from the coronavirus pandemic.",Investors are taking a closer look at the market's consumer discretionary companies as a reopening U.S. economy fuels hopes of a turnaround for some of the sector's hardest-hit names.,"Lufthansa's management board has accepted a more favourable set of demands from the European Commission in exchange for approval of a 9 billion euro ($10 billion) government bailout, the carrier said on Saturday, paving the way for its rescue.","U.S. pipeline operator Energy Transfer LP  will begin cutting about 6% of its workforce next week, underscoring the spreading impact of weak oil and gas prices on the energy business.","The Trump administration will study ways to safeguard Americans from the risks of investing in Chinese companies, U.S. president Donald Trump said on Friday, ratcheting up pressure on the firms to comply with U.S. accounting and disclosure rules.","The closing of a $252 million sale of the Philadelphia Energy Solutions (PES) oil refinery to a Chicago-based real estate developer has been delayed, a city official and source with knowledge of the agreement said on Friday."
