,date,timestamp,main_title,main_content,feature_title_0,feature_title_1,feature_title_2,video_title_0,video_title_1,video_title_2,stories_title_0,stories_title_1,stories_title_2,stories_title_3,stories_title_4,stories_title_5,stories_content_0,stories_content_1,stories_content_2,stories_content_3,stories_content_4,stories_content_5
20,20181221,20181221113124,Growth fears and U.S. government shutdown threat slam stocks,World stocks extended a steep sell-off on Friday as the threat of a U.S. government shutdown and further hikes in U.S. borrowing costs compounded investor anxieties over the trajectory of global economic growth.,"Ghosn re-arrested on fresh allegations, likely to spend Christmas in detention","Japan Inc exit from nuclear exports would leave field to Russia, China",Malaysia seeks $7.5 billion in reparations from Goldman Sachs: FT,Ousted Nissan chairman Ghosn re-arrested in Japan,Wall Street tumbles again,U.S. slams China for espionage,Toshiba has no immediate plans to sell memory chip stake: CEO,"Exclusive: China hacked HPE, IBM and then attacked clients - sources",Altria to buy $12.8 billion minority stake in e-cigarette company Juul,"Exclusive: Bangladesh says to collect, test samples of Johnson & Johnson Baby Powder",Foxconn to build $9 billion chip plant in China with local govt - Nikkei,Explainer: Arrested again: What are the new allegations against Nissan's Ghosn?,"Toshiba Corp  has no immediate plans to sell its 40.2 percent stake in Toshiba Memory Corp, its chief executive told Reuters, as the world's No. 2 producer of NAND flash memory chips prepares to go public within the next three years.","Hackers working on behalf of China's Ministry of State Security breached the networks of Hewlett Packard Enterprise Co and IBM, then used the access to hack into their clients' computers, according to five sources familiar with the attacks.","Marlboro cigarette maker Altria Group Inc  will buy a 35 percent stake in Juul Labs Inc for $12.8 billion, a marriage between an old-line tobacco giant and a fast-growing electronic-cigarette rival looking to make inroads among smokers.","Bangladesh will collect and test samples of Johnson & Johnson's  Baby Powder for asbestos in a couple of days, its main testing authority said on Friday, after a Reuters report last Friday that the firm knew for decades that cancer-causing asbestos could be found in the product.","Taiwan's Foxconn , Apple Inc's  iPhone assembler, is in the final stages of talks with the local government of the Chinese city of Zhuhai to build a chip plant there with a total investment of about $9 billion, the Nikkei business daily reported on Friday.","Japanese prosecutors arrested Nissan's  ousted chairman Carlos Ghosn for a third time on Friday, accusing him of aggravated breach of trust in transferring personal investment losses to the automaker."
21,20181222,20181222120034,"Nasdaq in bear market, first of the three major U.S. indexes","The Nasdaq Composite Index  confirmed on Friday it is in a bear market for the first time since 2008, underscoring fears that the longest bull run in history for U.S. stocks could soon be over.",JD.com CEO will not face assault charges in Minnesota,China's HNA in talks to sell Ingram Micro to Apollo Global: source,Credit Suisse chairman says on track to boost equity return: media,Nasdaq enters bear market,"Make a stock shopping list and include banks, says Ken Kamen",Bright outlook for Wall Street in '19,"As FAANG stocks falter, fund managers make bets on survivors",U.S. third-quarter growth trimmed; business spending slowing,Incoming Campbell Soup CEO Clouse to be paid up to $7.4 million in 2019,"Williams soothes markets, says Fed listening and could change policy","Wells Fargo moves jobs abroad after U.S. layoffs, government says",Automakers boost Takata air bag recall completion rates,A bear market in the so-called FAANG stocks - Wall Street's most popular trade going into the year - is pushing fund managers into searching for the next big growth companies that can lead the overall market higher.,"The U.S. economy slowed slightly more than previously estimated in the third quarter and momentum appears to have moderated further in the fourth quarter, with new orders and shipments of manufactured capital goods falling in November.","Campbell Soup Co  said on Friday that incoming Chief Executive Mark Clouse, a food industry veteran, could be paid as much as $7.4 million in compensation for fiscal 2019.","The Federal Reserve is listening to the concerns of markets and open to changing its policy views next year, one its most influential members said on Friday, even while he stood by plans for interest-rate hikes and further paring of the Fed's bond portfolio.","Wells Fargo & Co.  has been hiring overseas after pledging to eliminate thousands of jobs, according to a Department of Labor investigation.","Automakers in the United States repaired more than 7.2 million defective Takata air bag inflators in 2018, as companies have ramped up efforts to track down parts in need of replacement, a report from an independent monitor released on Friday said."
22,20181223,20181223120431,Japan court extends Ghosn detention by 10 days,"A Japanese court on Sunday extended for 10 days the detention of ousted Nissan Motor Co  chairman Carlos Ghosn, who is facing new allegations of making the car maker shoulder $16.6 million in personal investment losses.",Judge accepts CVS offer on Aetna while reviewing consent decree,Trump has discussed firing Fed Chairman Powell: sources,VW says diesel scandal cleanup to cost 2 billion euro in 2019: paper,Nasdaq enters bear market,"Make a stock shopping list and include banks, says Ken Kamen",Bright outlook for Wall Street in '19,Brazil judge overturns injunction that blocked Embraer-Boeing deal,"Nasdaq in bear market, first of the three major U.S. indexes",JD.com CEO will not face assault charges in Minnesota,China's HNA in talks to sell Ingram Micro to Apollo Global: source,Credit Suisse chairman says on track to boost equity return: media,"As FAANG stocks falter, fund managers make bets on survivors","A Brazilian judge overturned on Friday a decision that put the brakes on planemaker Embraer's  proposed sale of 80 percent of its commercial aviation division to Boeing Co , as the judicial back-and-forth surrounding the deal continued.","The Nasdaq Composite Index  confirmed on Friday it is in a bear market for the first time since 2008, underscoring fears that the longest bull run in history for U.S. stocks could soon be over.","Minnesota prosecutors will not charge the billionaire chief executive officer of China's JD.com Inc, Richard Liu, after he was accused of rape by a University of Minnesota student during a recent U.S. visit, authorities said on Friday.","HNA Group Co [HNAIRC.UL] is in talks to sell Ingram Micro Inc to private equity firm Apollo Global Management Llc , a source familiar with the matter said on Friday, as the Chinese conglomerate continues to scale back operations.","Cost cuts and closing a unit where Credit Suisse  had parked underperforming assets will help boost return on tangible equity (ROTE) to at least 10 percent in 2019, Chairman Urs Rohner said in an interview published on Saturday.",A bear market in the so-called FAANG stocks - Wall Street's most popular trade going into the year - is pushing fund managers into searching for the next big growth companies that can lead the overall market higher.
23,20181224,20181224110729,Markets far from merry as stock losses extend into seventh day,"World stocks were set for their seventh straight day of losses on Monday, as investors nervy about the possibility of a prolonged U.S. government shutdown and a worsening global economy opted for the safety of bonds and gold.","Top Trump official calls bankers, will convene 'Plunge Protection Team'",Index futures little changed ahead of holiday-shortened week,South Korea to file complaint against BMW for 'delayed' response to engine fires,Japan court extends Ghosn detention,Gatwick drone saboteur still at large,Government shutdown may roll into new year,Elon Musk says Tesla to pay customers for missed tax credits,Hyundai sees Russia auto market growth slowing in 2019,"Brent crude edges up, but concern over demand limits gains",Trump advisers have discussed arranging meeting with Fed's Powell: WSJ,AXA's Swiss employees mistakenly get double December pay,Bike-sharing firm Ofo's dramatic fall a warning to China's tech investors,Tesla Inc  chief executive Elon Musk said the electric car company will reimburse customers if delays to car deliveries cause them to miss out on a significant tax credit.,"South Korea-based carmaker Hyundai Motor Co.  expects growth in the Russian auto market to slow sharply next year, the head of its Russian branch said on Monday.","Oil prices edged up on Monday after evidence that a recent fall to 15-month lows may be affecting output in the United States, the world's largest producer, although concern about the outlook for demand tempered gains.","The advisers of President Donald Trump have discussed in recent days arranging a meeting between him and Federal Reserve Chairman Jerome Powell in the coming weeks, the Wall Street Journal reported on Sunday, citing a source.","French insurer AXA's  4,300 Swiss employees mistakenly got double their normal December salaries in a Christmas surprise that quickly fell flat when they learned they would not be allowed to keep the extra cash.","On the sidewalks of Shanghai and Beijing, once bright-yellow Ofo bicycles lie in varying states of disrepair - chains unhooked, wheels buckled and paint starting to fade - reflecting the quick rise and sharp fall of the Chinese bike-sharing startup."
24,20181225,20181225113521,Trump calls Fed 'only problem' in U.S. economy; markets slump,"President Donald Trump blasted the Federal Reserve on Monday, describing it as the ""only problem"" for the U.S. economy, as top officials convened to discuss the growing rout in stock markets caused in part by the president's attacks on the central bank.",Nissan's Kelly granted bail by Tokyo court; Christmas release possible,Intel to get 700 million shekel grant for Israel expansion,Talks to get Russian automaker GAZ off U.S. sanctions list ongoing: Siluanov,Last-minute shoppers flood stores,Wall Street sell-off worsens,Vista Equity Partners to buy Mindbody in a $1.9 bln deal,Rate futures market says Fed is all but done with hikes,Explainer: 'Plunge Protection Team' to convene amid Wall Street rout,Oil plunges 6 percent as economic slowdown fears grip market,"Wall Street selloff worsens on Mnuchin move, Washington drama","Guyana, Exxon in talks after Venezuela dispute halts marine survey",South Korea to file complaint against BMW for 'delayed' response to engine fires,The Federal Reserve is finished raising U.S. interest rates.,The Trump administration is arranging a phone call on Monday with top regulators to discuss financial markets amid a rout on Wall Street.,"Oil prices plunged more than 6 percent to the lowest level in more than a year on Monday, pulling back sharply late in the session as fears of an economic slowdown rattled the market.","The S&P; 500 tumbled to the brink of a bear market on Monday as U.S. stocks extended their steep sell-off in a pre-holiday shortened session, with investors rattled by the U.S. Treasury secretary's convening of a crisis group and by other political developments.","Guyana's government is ""in discussion"" with Exxon Mobil after two ships searching for oil off the South American country's coast halted work following a weekend confrontation with Venezuela's navy, Guyana's foreign minister said on Monday.",South Korea's transport ministry said it would file a complaint against German luxury carmaker BMW  with prosecutors for allegedly delaying recalls and concealing defects that led to several engine fires in the country this year.
25,20181226,20181226115119,Trump praises Treasury Secretary Mnuchin but hits Fed again on rate rises,"President Donald Trump on Tuesday expressed confidence in Treasury Secretary Steven Mnuchin amid worries over a weakening economy and a stock market slump, but repeated his criticism of the U.S. Federal Reserve, saying it has raised interest rates too quickly.",Asian stocks retreat as U.S. political tumult adds to growth worry,Oil rises to $51 after steep slide; growth fears weigh,Nissan's Kelly examined at Japanese hospital after securing bail,Trump dials back Fed attack after market plunge,Last-minute shoppers flood stores,Wall Street sell-off worsens,"German industry views Brexit, Trump as biggest risks to economy",Private buyers of Iran crude had no problems exporting it: oil minister,Russia's energy minister sees oil prices stabilizing in first-half 2019,Former Sinochem chief sentenced to 12 years for graft - state media,Trump calls Fed 'only problem' in U.S. economy; markets slump,Explainer: 'Plunge Protection Team' to convene amid Wall Street rout,Germany's leading industry groups said on Wednesday that Britain's departure from the European Union and trade disputes triggered by U.S. President Donald Trump's 'America First' policies were posing the biggest risks to growth and prosperity.,"Private buyers of Iranian crude have had ""no problems"" exporting it, Iran's oil minister was quoted as saying on Wednesday by state news agency IRNA, despite U.S. sanctions targeting Iran's oil exports.","Russian Energy Minister Alexander Novak said on Tuesday that oil prices, which fell by more than a third this quarter, would become more stable in the first half of 2019.","A Chinese court sentenced the former general manager of Sinochem Group to 12 years in prison, state TV reported on Wednesday.","President Donald Trump blasted the Federal Reserve on Monday, describing it as the ""only problem"" for the U.S. economy, as top officials convened to discuss the growing rout in stock markets caused in part by the president's attacks on the central bank.",The Trump administration is arranging a phone call on Monday with top regulators to discuss financial markets amid a rout on Wall Street.
26,20181227,20181227120201,"Exclusive: White House considers new year executive order to bar Huawei, ZTE purchases","President Donald Trump is considering an executive order in the new year to declare a national emergency that would bar U.S. companies from using telecommunications equipment made by China's Huawei and ZTE, three sources familiar with the situation told Reuters.",Wall Street surge lifts world stocks off 22-month low,U.S. Commerce Department won't publish economic data during shutdown: WSJ,Exclusive: Foxconn to begin assembling top-end Apple iPhones in India in 2019 - source,Venezuela cocoa growers fear new pest: the government,"Dow soars over 1,000 points in rebound","Dow surges over 1,000 points",Oil slips back toward 18-month lows on oversupply,China says has made plans with U.S. for face-to-face trade meeting in January,Activist fund Argyle asks Toshiba to exit TEC business to boost margins,Exclusive: New allegations against Ghosn concern payments to Saudi businessman - sources,JPMorgan to pay more than $135 million for improper handling of ADRs,China's Sinopec suspends top officials at trading arm: sources,"Oil prices fell on Thursday after rebounding 8 percent in the previous session, as worries over a glut in crude supply and concerns over a faltering global economy pressured prices even as a stock market rally offered support.","China and the United States have made plans for face-to-face consultations over trade in January, the Chinese commerce ministry said on Thursday, as the world's two biggest economies advanced efforts to resolve a months-long trade war.",Hong Kong-based activist fund Argyle Street Management asked Japan's Toshiba Corp  on Thursday to exit more non-core businesses such as office machinery company Toshiba TEC  to bolster margins of the once-mighty conglomerate.,"Fresh misconduct allegations brought by Tokyo prosecutors against ousted Nissan Chairman Carlos Ghosn center on the use of company funds to pay a Saudi businessman who is believed to have helped him out of financial difficulties, two company sources with knowledge of the matter said.","JPMorgan Chase & Co  will pay over $135 million to settle charges it mishandled so-called ""pre-released"" American Depositary Receipts (ADRS), the Securities and Exchange Commission announced on Wednesday.","Chinese state oil major Sinopec has suspended the two top officials at its trading arm Unipec after the company suffered losses, sources with knowledge of the matter said on Thursday."
27,20181228,20181228123339,Green Growth to launch hostile bid for pot producer Aphria,U.S. cannabis retailer Green Growth Brands Ltd  said on Thursday it would make a hostile takeover bid for Aphria Inc  in an all-stock deal valuing the Canadian pot producer at C$2.8 billion ($2.06 billion).,"Exclusive: White House mulls new year executive order to bar Huawei, ZTE purchases",Exclusive: Chile to delay arbitration with top lithium producer Albemarle,Stock futures higher as Wall St.'s post-Christmas rally continues,Wall Street rebounds to end higher,Exclusive: Foxconn to make iPhones in India-source,"Diversification will work in '19, says Kevin Mahn",Global stocks cautiously follow Wall Street's surge,Nissan to make fewer cars in China in months ahead as demand slows: source,Drop in U.S. consumer confidence stokes fears of economic slowdown,Oil prices rebound but still weak due to oversupply,Rosneft to buy at least 6 million tonnes of oil for $2 billion in 2019,"Yankees in talks with Amazon, Sinclair to bid for Yes Network: WSJ","Stocks in Europe and Asia rose cautiously on Friday after Wall Street ended a volatile session with big gains, but fears of further price swings and worries about U.S. politics kept safe-haven currencies such as the yen and Swiss franc in demand.","Nissan Motor Co  will produce 30,000 fewer vehicles in the coming months in China than what it had planned, a person briefed on the matter told Reuters, as global automakers grapple with falling demand in the world's biggest car market.","A measure of U.S. consumer confidence posted its sharpest decline in more than three years in December, rattling investors already nervous about the prospect that a global economic slowdown was spilling over into the United States.","Oil prices rebounded on Friday, recovering slightly from heavy losses this week, but remained close to the lowest levels in over a year as rising U.S. inventories and concern over global economic growth rattled markets.","Russia's largest oil producer Rosneft  will buy around 6 million tonnes of oil worth over $2 billion from domestic producers next year, according to an announcement on a state-owned website for purchases of companies' needs.","The New York Yankees are in talks with Amazon.com Inc and Sinclair Broadcast Group Inc about a joint bid for the team's regional sports network, Yes, the Wall Street Journal reported on Friday, citing people familiar with the matter."
28,20181229,20181229115243,"Trade wars cost U.S., China billions of dollars each in 2018","The U.S.-China trade war resulted in billions of dollars of losses for both sides in 2018, hitting industries including autos, technology - and above all, agriculture.",Defensive stocks top 2019 playbooks,Is China buying U.S. soy? Washington shutdown keeps traders guessing,Sears Chair Lampert makes $4.4 billion bid to keep retailer alive,PREDICTIONS: East Africa will make trade freer,Wall Street swings as it caps off wild week,Wall Street rally pauses but mints weekly gain,U.S. retirees try to keep cool as stocks tumble,Wells Fargo to pay $575 million in settlement with U.S. states,Tesla names close Musk friend Larry Ellison to board,Oil prices steady near year-and-a-half lows ahead of New Year,"Yankees in talks with Amazon, Sinclair to bid for Yes Network: WSJ",Take Five: The Year of the Bear! World markets themes for the week ahead,"Nancy Farrington, a retiree who turns 75 next month, admits to being in a constant state of anxiety over the biggest December stock market rout since Herbert Hoover was president.","Wells Fargo & Co  will pay $575 million to settle claims made by U.S. states, the latest settlement as the bank works to resolve lingering investigations and legal battles stemming from its sales-practices scandal and to remove a punitive asset cap.","Tesla Inc on Friday named Oracle Corp co-founder Larry Ellison, a shareholder and self-described close friend of Chief Executive Elon Musk, to its board to provide the  independent oversight demanded by U.S. regulators after Musk tweeted about taking the electric carmaker private.","Oil prices steadied on Friday after a week of volatile trading ahead of the New Year holiday, supported by a rise in U.S. equity markets but pressured by worries about a global glut of crude.","The New York Yankees are in talks with Amazon.com Inc and Sinclair Broadcast Group Inc about a joint bid for the team's regional sports network, Yes, the Wall Street Journal reported on Friday, citing people familiar with the matter.",Following are five big themes likely to dominate thinking of investors and traders in the coming week and the Reuters stories related to them.
29,20181230,20181230122501,Trump says 'big progress' on possible China trade deal,"U.S. President Donald Trump said on Twitter that he had a ""long and very good call"" with Chinese President Xi Jinping and that a possible trade deal between the United States and China was progressing well.","Deutsche Bank is strong, has no need for state aid, merger"" chairman",Pacific trade pact takes off with tariffs cut in six nations,Defensive stocks top 2019 playbooks,PREDICTIONS: East Africa will make trade freer,Wall Street swings as it caps off wild week,Wall Street rally pauses but mints weekly gain,"Trade wars cost U.S., China billions of dollars each in 2018",Is China buying U.S. soy? Washington shutdown keeps traders guessing,Sears Chair Lampert makes $4.4 billion bid to keep retailer alive,U.S. retirees try to keep cool as stocks tumble,Wells Fargo to pay $575 million in settlement with U.S. states,Tesla names close Musk friend Larry Ellison to board,"The U.S.-China trade war resulted in billions of dollars of losses for both sides in 2018, hitting industries including autos, technology - and above all, agriculture.","Commodity traders are in the dark because of the partial U.S. government shutdown, unable to see daily and weekly reports of agricultural exports to obtain clues as to whether China is following through with promises to buy grain and soy amid the ongoing trade war.","Sears Holdings Corp Chairman Eddie Lampert submitted a $4.4 billion takeover bid for the bankrupt U.S. retailer, representing its only chance of escaping liquidation and laying off tens of thousands of workers, a spokesman for the billionaire's hedge fund said on Friday.","Nancy Farrington, a retiree who turns 75 next month, admits to being in a constant state of anxiety over the biggest December stock market rout since Herbert Hoover was president.","Wells Fargo & Co  will pay $575 million to settle claims made by U.S. states, the latest settlement as the bank works to resolve lingering investigations and legal battles stemming from its sales-practices scandal and to remove a punitive asset cap.","Tesla Inc on Friday named Oracle Corp co-founder Larry Ellison, a shareholder and self-described close friend of Chief Executive Elon Musk, to its board to provide the  independent oversight demanded by U.S. regulators after Musk tweeted about taking the electric carmaker private."
