,date,timestamp,main_title,main_content,feature_title_0,feature_title_1,feature_title_2,video_title_0,video_title_1,video_title_2,stories_title_0,stories_title_1,stories_title_2,stories_title_3,stories_title_4,stories_title_5,stories_content_0,stories_content_1,stories_content_2,stories_content_3,stories_content_4,stories_content_5
20,20190921,20190921132131,Hopes for trade breakthrough fade as China cancels U.S. farm visits,A U.S.-China trade deal appeared elusive on Friday after Chinese officials unexpectedly canceled a visit to farms in Montana and Nebraska as deputy trade negotiators wrapped up two days of negotiations in Washington.,Exclusive: Fitbit considers whether it should explore a sale - sources,Delaware judge says Tesla board must face trial over Musk's mega-pay package,Ailing Thomas Cook in talks with UK government and investors for rescue deal,Stocks drop after China cancels Montana farm trip,Trump says China's agricultural purchases not enough,What to watch in the week ahead,"Fed in three voices: recession, bubbles, and 'in a good place'","Commerzbank aims to cut jobs, branches after Deutsche merger fails",Fund managers gird for long trade war after FedEx slide,U.S. trade regulators approve some Apple tariff exemptions amid broader reprieve,"Warren, Sanders to visit striking GM workers as dispute continues",Saudi Aramco sees full oil production from attacked sites by end September,"After delivering a split-decision rate cut earlier this week, U.S. Federal Reserve officials put their divisions on full display Friday, with warnings of a slowdown on the one hand and financial risks on the other bookending talk of how well things are going.","Commerzbank said on Friday it wanted to shed thousands of staff and close a fifth of its branches in a strategy overhaul, after the German lender's attempt to merge with Deutsche Bank failed.",A profit warning and muted outlook from package delivery company FedEx Corp  is prompting some high-profile fund managers to prepare for the trade war between the United States and China to last longer than many had originally anticipated.,"U.S. trade regulators on Friday approved 10 out of 15 requests for tariff exemptions filed by Apple Inc  amid a broader reprieve on levies on computer parts, according to a public docket published by the U.S. Trade Representative and a Federal Register notice.",Two major Democratic presidential candidates plan to visit striking General Motors  workers in Detroit in the coming days as a five-day-old labor dispute threatens to enter its second week.,"Saudi state oil company Aramco said it will bring back by end September full crude output at Abqaiq and Khurais, the two oil facilities damaged by attacks last weekend that U.S. officials have blamed on Iran."
21,20190922,20190922131200,"Eyes on U.S. prize, Primark considers Central American suppliers","Confident it can crack the $300 billion U.S. clothing and shoes market where many other foreign retailers have failed, Britain's Primark is ready to raise its bet on the country by securing new sources of fast fashion in central America.",Big companies commit to slash emissions ahead of U.N. climate summit,Budget carrier XL Airways seeks rescue deal with Air France,"China needs to change way it finances economy, think tank says",Stocks drop after China cancels Montana farm trip,Trump says China's agricultural purchases not enough,What to watch in the week ahead,Saban to return controlling stake in Israel's Partner Comms: media,Exclusive: Fitbit considers whether it should explore a sale - sources,Hopes for trade breakthrough fade as China cancels U.S. farm visits,Travel group Thomas Cook battles for survival with final creditor meeting,Fund managers gird for long trade war after FedEx slide,Huawei to join forces with China Mobile to bid for Brazil's Oi: report,"U.S.-Israeli media magnate Haim Saban plans to give up his controlling stake in Israeli mobile phone operator Partner Communications , financial media reported on Sunday.","Wearable device maker Fitbit Inc  has been in talks with an investment bank about the possibility of exploring a sale amid challenges in successfully pivoting from fitness trackers to smartwatches, people familiar with the matter said on Friday.",A U.S.-China trade deal appeared elusive on Friday after Chinese officials unexpectedly canceled a visit to farms in Montana and Nebraska as deputy trade negotiators wrapped up two days of negotiations in Washington.,"Bosses at Britain's Thomas Cook  were meeting lenders and creditors on Sunday to decide whether the world's oldest travel company could survive until Monday, or face a chaotic collapse that would be felt around the world.",A profit warning and muted outlook from package delivery company FedEx Corp  is prompting some high-profile fund managers to prepare for the trade war between the United States and China to last longer than many had originally anticipated.,"Chinese telecoms equipment maker Huawei Technologies Co is joining forces with China Mobile  to potentially enter a dispute to buy struggling Brazilian carrier Oi SA , in an attempt to boost its footprint in Latin America's largest market, O Globo news website reported on Saturday."
22,20190923,20190923131132,Hundreds of thousands stranded after British travel firm Thomas Cook collapses,"Hundreds of thousands of holidaymakers were stranded on Monday by the collapse of the world's oldest travel firm Thomas Cook , sparking the largest peacetime repatriation effort in British history.",Futures muted after Wall Street's worst day in about two weeks,"Vivendi keeps Mediaset stake, prepares to step up legal fight: sources","At shuttered Ohio plant, workers still hope for new GM vehicle","British travel firm Thomas Cook collapses, leaving hundreds of thousands stranded",Self-driving hopefuls seek new strategies in autonomous race,Airline shares jump after Thomas Cook collapse,U.S. FAA head set to explain Boeing 737 MAX progress to divided world regulators,Exclusive: Boeing bid for Embraer unit faces EU antitrust probe - sources,Huawei CFO's arrest at airport to be focus of Vancouver hearing,Exclusive: Ceconomy eyes deal with heirs of Media Markt founder - sources,"Swiss probe incident involving ex-Credit Suisse banker Khan, private detectives","Hyundai Motor Group, Aptiv to set up $4 billion self-driving car JV",The chief of the U.S. Federal Aviation Administration is set to detail on Monday progress on the Boeing 737 MAX aircraft to international air regulators who are divided about returning the grounded jet to flight after two fatal crashes.,"Boeing is set to face a EU antitrust investigation of up to five months into its bid for a controlling stake in the commercial aircraft arm of Brazil's Embraer, people familiar with the matter said on Monday.",Lawyers for Huawei Chief Financial Officer Meng Wanzhou will be in a Canadian courtroom on Monday to press for details surrounding her arrest at Vancouver's airport nearly 10 months ago.,"Germany's Ceconomy , Europe’s biggest consumer electronics group, is in talks to resolve a long-running dispute with a major shareholder of subsidiary Media Saturn, people close to the matter said on Monday.","Zurich prosecutors have opened a criminal investigation into an incident last week in which private detectives allegedly shadowed ex-Credit Suisse  banker Iqbal Khan and his wife, the district attorney's office said on Monday","Hyundai Motor Group will invest $1.6 billion in a joint venture to develop self-driving vehicle technologies with Aptiv , the biggest overseas investment by the South Korean carmaker to catch up to rivals in the autonomous car market."
23,20190924,20190924110300,"After Thomas Cook collapse, UK PM asks why bosses got paid millions","After the collapse of Thomas Cook left tens of thousands of Britons reliant on the government to bring them home, Prime Minister Boris Johnson questioned whether the travel firm's bosses should have paid themselves so much ahead of its demise.",AB InBev Asia unit raises $5 billion in revived Hong Kong IPO under shadow of protests,Nintendo's Mario takes driving seat in race for mobile hit,"Starbucks wins, Fiat loses in EU tax fights",UK PM weighs in on Thomas Cook collapse,AB InBev Asia unit raises $5 bln in IPO,Wall Street ends flat,"European shares resume gains, pound waits on Supreme Court ruling",German prosecutors indict top VW bosses over emissions scandal,Google wins in 'right to be forgotten' fight with France,HKEX 'thinking big' with $39 billion bid as LSE sticks to Refinitiv plan,Uber receives just a two-month London license with new safety conditions,Exclusive: Aviva's Asian units attract interest from global suitors - sources,"European shares rose on Tuesday, following their worst day in over a month, after Washington said the United States and China would resume trade talks. Britain's pound was laying low before the next act in the Brexit drama.","German prosecutors have brought criminal charges of stock market manipulation against Volkswagen  CEO Herbert Diess, former CEO Martin Winterkorn and Chairman Hans Dieter Poetsch in connection with the carmaker's emissions cheating scandal.","Google  won its fight against tougher ""right to be forgotten"" rules after Europe's top court said on Tuesday it does not have to remove links to sensitive personal data worldwide, rejecting a French demand.","Hong Kong Exchange and Clearing (HKEX) said it was ""thinking big"" in its $39 billion London Stock Exchange bid as LSE CEO David Schwimmer said he was sticking with his $27 billion purchase of data and analytics company Refinitiv.","Uber on Tuesday received only a two-month London operating license, failing to secure a maximum five-year term in a battle with the regulator which has previously stripped the app of its right to take rides.","German insurer Allianz, Nippon Life and MS&AD; Insurance are vying with rivals to buy the Singapore and Vietnam businesses of Britain's Aviva in a deal likely to be worth up to $2.5 billion, sources said."
24,20190925,20190925120421,"Juul Labs suspends advertising in U.S., replaces CEO","Juul Labs said on Wednesday it would suspend all broadcast, print and digital product advertising in the United States, and replaced Chief Executive Officer Kevin Burns with Altria Group Inc  executive K.C. Crosthwaite.",WeWork chief Neumann's top lieutenants step up as successors,Britain to operate 70 flights to bring back people after Thomas Cook collapse,Nintendo's Mario mobile game has server overload on launch day,"Shares stumble over Trump impeachment threat, China jibes",Thomas Cook's German wings aim to fly on,Nike beats quarterly forecasts despite trade war,Former Danske Bank Estonian head found dead by police,VW workers applaud chairman despite indictment,"Sanctions-hit Iran props up economy with bartering, secret deals","Futures fall on Trump impeachment push, Nike gains",Saudi Aramco seeks project finance loan of more than $1 billion: sources,Thyssenkrupp plunged into turmoil as CEO Kerkhoff set to leave,"A former head of Danske Bank's  Estonian branch, who was a witness in an investigation into alleged money laundering, has been found dead by police in Estonia.","Volkswagen  workers applauded Chairman Hans Dieter Poetsch at a mass meeting of employees at its headquarters on Wednesday, according to a participant, as staff appeared to close ranks behind its senior managers, three of whom have been indicted.","Washington's policy of applying ""maximum pressure"" on Iran with wide-ranging sanctions has shredded the country's oil revenues, sent its economy into recession and devalued its national currency.","U.S. stock index futures edged lower on Wednesday as a move to launch an impeachment inquiry into President Donald Trump injected a fresh dose of uncertainty, with forecast-beating results from Nike Inc helping dispel some gloom.","Saudi Aramco has asked banks to submit proposals for a project finance loan of more than $1 billion, two sources with direct knowledge of the matter said.","Thyssenkrupp  said it was preparing to replace its chief executive Guido Kerkhoff, making him the latest casualty at the German steel-to-submarines conglomerate which has been in crisis mode for more than a year."
25,20190926,20190926130005,"In Michigan steel towns, tariffs meant to revive industry cost jobs","Some steelworkers who cheered U.S. President Donald Trump's tariffs on foreign steel last year are now being laid off, an unintended consequence of his America First policy as United States Steel Corp reacts to sagging demand from automakers reeling from higher steel prices.",Exclusive: Saudi Aramco lures sovereign funds to hit $2 trillion IPO valuation - sources,"Exclusive: Texas signs ex-Microsoft lawyer, others to aid in Google antitrust probe",Futures edge higher on U.S.-China trade optimism,BA-owner IAG warns of profit hit from strikes,Bulgarian economist named new IMF chief,How a sanctions-busting industry soars in N.Korea,"Its leash lengthened, China's yuan flirts with trade war role","UK to repatriate 16,000 people on fourth day of Thomas Cook collapse",Huawei already producing 5G base stations without U.S. parts: CEO,Norway will not ban Huawei from 5G mobile network: minister,Hackers tried to steal Airbus secrets via contractors: AFP,Samsung to offer financing to help to boost India smartphone sales,"China, having let the yuan cross the once sacred red line of 7 per dollar, will allow its currency to fall further and may even risk U.S. anger by using it as a bargaining chip in already thorny trade talks, market participants believe.","Britain's Civil Aviation Authority (CAA) said over 70 flights are scheduled for Thursday to bring back 16,000 people to the country following the collapse of Thomas Cook.",Huawei Technologies Co Ltd's [HWT.UL] founder and CEO Ren Zhengfei said on Thursday the company is already producing 5G base stations that are free of U.S. components and plans to more than double production next year.,"Norway does not plan to block China's Huawei Technologies[HWT.UL] from building the country's 5G telecoms network, cabinet minister Nikolai Astrup told Reuters, a decision that puts it at odds with NATO ally the United States.","A series of cyber attacks on Airbus  in the past few months were conducted via the computer systems of its suppliers and contractors and security sources suspect a link to China, AFP news agency reported on Thursday.","Samsung Electronics is to provide finance to potential smartphone buyers, a company executive said on Thursday, in a bid to boost smartphone sales in India where it faces fierce competition from rivals such as China's Xiaomi."
26,20190927,20190927120814,"GM reverses, will pay for striking union workers' health insurance; major issues remain","General Motors Co said on Thursday it will pay for the health insurance of its striking hourly workers, reversing a decision to push the costs onto the United Auto Workers union as officials on both sides said major issues remain to be resolved.",Oil shipping rates soar as U.S. supertanker sanctions rattle crude trade,China's top diplomat says Beijing willing to buy more U.S. products,Apple will seek theater deals for movies before streaming: WSJ,Saudi Arabia throws open door to tourists,U.S. gets green light for European jet tariffs,China says ready to buy more U.S. goods,WeWork's Neumann voted to oust himself as CEO after failed IPO: sources,Wells Fargo names BNY Mellon's Charles Scharf as CEO,Shares rise as trade optimism muffles impeachment noise,"UK to repatriate 16,000 people on fifth day after Thomas Cook collapse",Germany to name Lautenschlaeger successor soon: ministry,HSBC flips crime-spotting tool to scope new business,"When WeWork's directors voted on Tuesday to oust Adam Neumann as chief executive after a failed attempt to take the office-sharing startup public, Neumann cast his vote against himself, according to three people familiar with the situation.","Wells Fargo & Co  on Friday named Charles Scharf, the chief executive officer of Bank of New York Mellon , to its top job.","World shares erased losses on Friday, buoyed by a wave of optimism that U.S.-China trade tensions might be easing as markets largely brushed off concerns about possible impeachment moves against U.S. President Donald Trump.","UK's Civil Aviation Authority said on Friday 72 flights are scheduled to operate to bring back a further 16,000 people to the country following the collapse of Thomas Cook.","Germany intends to remain represented on the Executive Board of the European Central Bank and will shortly name a candidate to succeed Sabine Lautenschlaeger, who announced she would resign earlier this week, a Finance Ministry spokesman said.","British bank HSBC  has converted a financial crime-spotting algorithm it was forced to build in the wake of a money-laundering scandal into one that can scope out new business opportunities, bank executives said."
27,20190928,20190928134510,"After WeWork debacle, IPO market slams brakes on unprofitable companies","Companies making their debut on the U.S. stock market are getting a rough welcome, especially if they are losing money,  casting a shadow over the calendar for initial public offerings for the rest of the year.",Trump considers delisting Chinese firms from U.S. markets: sources,"FTC requests AbbVie, Allergan for more information on $63 billion deal",Spillover: world economies' next big headache,Stocks decline as new trade war fears emerge,"Buy healthcare, fade tech in current political climate -Tocqueville analyst","Disney, Sony reach Spider-Man movie deal",U.S. labor judge rules that Tesla broke labor law,"Wall Street Week Ahead: Data will show damage of tariffs, strong dollar on U.S. goods exporters",SoftBank seeks help from its COO to turn WeWork around: Bloomberg,"UK to repatriate 16,700 Thomas Cook customers on Saturday",U.S. FAA requiring inspections for cracks on some 737 NG planes,Cooling U.S. consumer spending underscores risks to economy,"Electric carmaker Tesla Inc interfered with legitimate union organizing and must read a notice to workers explaining their rights in a meeting requiring attendance from Chief Executive Elon Musk, a U.S. labor judge ruled on Friday.","It's no longer a probability, it's a reality: the escalating U.S.-China trade war and the strengthening dollar appear to be inflicting measurable damage on U.S. goods makers that rely on global markets.","Japan's SoftBank Group Corp  is seeking the help of its chief operating officer, Marcelo Claure, to turn around WeWork, Bloomberg reported on Friday.","A further 16,700 customers of collapsed British travel firm Thomas Cook are scheduled to be repatriated on Saturday on 76 flights, the country's aviation regulator said.",The U.S. Federal Aviation Administration late on Friday said it would require operators of some Boeing  737 NG jetliners to conduct inspections for structural cracks and make repairs as needed following the discovery of cracks on a small number of planes.,"U.S. consumer spending barely rose in August and business investment remained subdued amid lingering trade tensions, prompting economists to slash their economic growth estimates for the third quarter."
28,20190929,20190929134540,China urges 'calm and rational' resolution to U.S.-Sino trade war,"China hopes Beijing and Washington will resolve their trade dispute ""with a calm and rational attitude"", Vice Commerce Minister Wang Shouwen said on Sunday, ahead of talks in two weeks between the two sides.","After WeWork debacle, IPO market slams brakes on unprofitable companies",Boeing omitted safeguards on 737 MAX that were used on military jet: WSJ,Hong Kong's sky-high property prices prove resilient in face of protests,Trump considers delisting Chinese firms - sources,Stocks decline as new trade war fears emerge,"Buy healthcare, fade tech in current political climate -Tocqueville analyst","FTC requests AbbVie, Allergan for more information on $63 billion deal",Spillover: world economies' next big headache,U.S. labor judge rules that Tesla broke labor law,"Wall Street Week Ahead: Data will show damage of tariffs, strong dollar on U.S. goods exporters",SoftBank seeks help from its COO to turn WeWork around: Bloomberg,Cooling U.S. consumer spending underscores risks to economy,"The U.S. Federal Trade Commission (FTC) has requested for more information from AbbVie Inc  and botox maker Allergan Plc  on their $63 billion deal, the companies said on Friday.",Factories have been the first victims of the Trump-era global trade rows. Now the question is how much their troubles will spread to other parts of the world's biggest economies: the so-called spillover effect.,"Electric carmaker Tesla Inc interfered with legitimate union organizing and must read a notice to workers explaining their rights in a meeting requiring attendance from Chief Executive Elon Musk, a U.S. labor judge ruled on Friday.","It's no longer a probability, it's a reality: the escalating U.S.-China trade war and the strengthening dollar appear to be inflicting measurable damage on U.S. goods makers that rely on global markets.","Japan's SoftBank Group Corp  is seeking the help of its chief operating officer, Marcelo Claure, to turn around WeWork, Bloomberg reported on Friday.","U.S. consumer spending barely rose in August and business investment remained subdued amid lingering trade tensions, prompting economists to slash their economic growth estimates for the third quarter."
29,20190930,20190930114122,Forever 21 latest retailer to file for bankruptcy,"Fashion retailer Forever 21 Inc filed for bankruptcy on Sunday, as it joined a growing list of brick-and-mortar players who have succumbed to the onslaught of e-commerce companies such as Amazon.com Inc .",GM and UAW union to continue talks on new labor deal,Shares steady as investors shrug off U.S. delisting threat,"Exclusive: Dubai Aerospace drops plans for big aircraft order, targets M&A; deal",German data holds up despite manufacturing slump,Saudi crown prince warns of soaring oil prices,Fashion chain Forever 21 files for bankruptcy,"On U.S. delisting threat, China says 'decoupling' would harm both sides",Exclusive: Mexico's Pemex seeks control of U.S. oil firm's billion-barrel find,Record U.S. tariff award over Airbus aid could fuel trade tensions,"Bank of America, Morgan Stanley eye growth in employee-benefits management",UK Markets watchdog fines Prudential 24 million pounds over annuity sales,Exclusive: Fintech firm Revolut to hire 3500 staff in global push with Visa,"China warned on Monday of instability in international markets from any ""decoupling"" of China and the United States, after sources said the Trump administration was considering delisting Chinese companies from U.S. stock exchanges.","When U.S. oil firm Talos Energy found nearly a billion barrels off Mexico's southern Gulf coast two years ago, it marked the first discovery by a foreign firm since the oil industry was nationalized eight decades earlier.",Transatlantic trade ties face renewed disruption this week when global arbiters are expected to grant the United States a record award allowing it to hit European imports with billions of dollars of tariffs in a long-running aircraft subsidy dispute.,"Morgan Stanley  and Bank of America Corp  are expanding the employee-benefits services they offer, hoping to gain market share in the dull-but-reliable business of managing wealth for companies and employees.","Britain's markets watchdog has fined the country's largest insurer Prudential  24 million pounds ($29.39 million) for failures related to non-advised sales of annuities, it said on Monday.","British-based digital banking app Revolut is set to hire around 3500 staff as it expands into 24 new markets thanks to a new global deal with payments giant Visa Inc, the two companies said on Monday."
