,date,timestamp,main_title,main_content,feature_title_0,feature_title_1,feature_title_2,video_title_0,video_title_1,video_title_2,stories_title_0,stories_title_1,stories_title_2,stories_title_3,stories_title_4,stories_title_5,stories_content_0,stories_content_1,stories_content_2,stories_content_3,stories_content_4,stories_content_5
20,20190821,20190821122646,"Citigroup, BNP caught up in U.S. case against Huawei CFO: documents","U.S.-based Citigroup  and French bank BNP Paribas  are caught up in the U.S. criminal case against the chief financial officer of China's Huawei Technologies,  according to newly available documents.",Texas shale towns grapple with growth as oil-bust fears fade,"Trump says he had to 'take China on,' regardless of short-term impact on U.S. economy","Futures gain on upbeat Target, Lowe's earnings; Fed minutes eyed",UK fast-tracks firms for customs roll as it readies for Brexit,Fiat-Renault deal hints lift European shares,EXCLUSIVE: Alibaba shelves HK listing amid unrest,EU antitrust regulators raise concerns about Facebook's Libra currency: sources,Exclusive: Alibaba postpones up to $15 billion Hong Kong listing amid protests: sources,Target raises profit forecast as same-day services power quarterly beat,Apple plans to tap China's BOE Technology for advanced iPhone screens: Nikkei,Osram to clear way for AMS takeover offer tonight: sources,Court grants Ryanair injunction to stop Irish pilot strike,"EU antitrust regulators want to know whether Facebook's  proposed Libra cryptocurrency and its use of consumer data pose possible anti-competitive constraints, people familiar with the matter said on Wednesday.","China's biggest e-commerce company Alibaba Group Holding Ltd has delayed its up to $15 billion listing in Hong Kong amid growing political unrest in the Asian financial hub, two people with knowledge of the matter told Reuters.","Target Corp raised its annual profit forecast on Wednesday after reporting better-than-expected quarterly results as higher investments to remodel stores and beef up digital business drew in more shoppers, sending shares up nearly 15%.","Apple Inc  is in the final stages of certifying advanced screens from Chinese display maker BOE Technology Group Co Ltd  for its iPhones, as it attempts to reduce reliance on Samsung Electronics, the Nikkei reported on Wednesday.","Osram  will most likely waive an agreement that currently prevents AMS  from making a takeover bid, paving the way for the Austrian group to enter the ring against finance investors Bain Capital and Carlyle Group , sources told Reuters.",The Irish High Court on Wednesday granted Ryanair  an injunction to prevent its Dublin-based pilots from going on strike later this week.
21,20190822,20190822120540,"Fed was divided on rate cut, wanted to avoid appearing on path for more cuts","Federal Reserve policymakers were deeply divided over whether to cut interest rates last month but were united in wanting to signal they were not on a preset path to more cuts, a message not likely to sit well with U.S. President Donald Trump.","Over Fed minutes, a Trump-shaped shadow",Explainer: What are the obstacles to Bayer settling Roundup lawsuits?,Boeing spacecraft astronauts see new frontier for commercial space,Boeing's space tourism: flying the 'friendly' skies,Markets await rate cut clues from Fed chief,Colombia coffee growers' new nemesis: machines,Fed doubts dominate as futures tick lower,Volkswagen CEO interested in Tesla stake: Manager Magazin,South Korea's top court to rule on Samsung heir's bribery case on August 29,"China says hopes U.S. stops wrong tariff action, vows to retaliate if new levies imposed","Audi to join Mercedes, BMW development alliance: paper",Dozens of Airbus A380s face urgent checks after cracked part dug from ice,Wall Street's main markets were set to edge lower on Thursday as the previous session's hints of a skeptical Federal Reserve attitude to a new cycle of interest rate cuts offset a handful of more bullish signs from U.S. retailers.,"Volkswagen  CEO Herbert Diess is interested in acquiring a stake in Tesla , German business publication Manager Magazin reported on Thursday, citing company sources.",South Korea's Supreme Court is to rule next Thursday on whether to uphold a reduced sentence given to Samsung Group heir Jay Y. Lee or ask an appeals court to revisit a case that was part of a graft scandal that brought down the president in 2017.,"China said on Thursday it hopes the United States will stop its wrong tariff action, adding that any new tariffs would lead to escalation.","Audi  is set to join an alliance with rivals Daimler  and BMW  to develop advanced driving assistance systems, German weekly Wirtschaftswoche said on Thursday.","Investigators probing an engine explosion on an Air France A380 in 2017 are studying a possible manufacturing flaw in a recently salvaged cracked part in a move likely to trigger urgent checks on dozens of Airbus superjumbos, people familiar with the matter said."
22,20190823,20190823130538,Billionaire industrialist David Koch has died,"Billionaire industrialist David Koch, a former executive vice president of conglomerate Koch Industries and a major backer of conservative causes and political candidates, has died, his brother said on Friday.",Huawei says U.S. curbs to cut smartphone unit's revenue by over $10 billion,Seeking clarity from Fed's Powell? Good luck with that,China strikes back in trade dispute with U.S. with new tariffs,Huawei says impact of U.S. curbs not as bad as feared,Shares in Peppa Pig owner rise past Hasbro offer,Overstock CEO resigns amid Russian agent link,Stock futures turn sharply lower after China threatens tariffs on U.S. goods,"Volkswagen recalls 679,000 U.S. vehicles that could roll away","Russia starts sales of 'Putin limousine', eyes Chinese market","Walmart, Tesla look to address issues surrounding solar systems",Shares in Peppa Pig owner rise past Hasbro offer,British judge orders confiscation of $1 million in cryptocurrencies from jailed hacker,U.S. stocks futures fell sharply on Friday after China said it would impose tariffs on about $75 billion worth of U.S. goods.,"Volkswagen AG said Friday it is recalling 679,000 U.S. vehicles sold since 2011 that could roll away because of an electrical issue.","Russia opened a showroom on Friday selling its first post-Soviet luxury limousine under the Aurus brand, a type of car used by President Vladimir Putin at his inauguration last year.","Walmart Inc  and Tesla Inc  are looking to address all issues surrounding the solar installations at Walmart stores, the companies said late on Thursday, two days after the retailer sued the electric carmaker for ""widespread negligence"" that led to repeated fires at the installations.","Peppa Pig-owner Entertainment One's  shares rose more than 30% to a record high on Friday, surpassing the price agreed by the company's board with U.S. toy maker Hasbro Inc  in a sign that investors see some chance of a counter offer.","A London judge ordered on Friday the confiscation of bitcoin and other digital currencies worth nearly $1 million from a prolific computer hacker, in the first case of its kind for Britain's biggest police force."
23,20190824,20190824103255,Trump heaps another 5% tariff on Chinese goods in latest tit-for-tat escalation,U.S. President Donald Trump on Friday lashed back at a new round of Chinese tariffs by heaping an additional 5% duty on some $550 billion in targeted Chinese goods in the latest tit-for-tat trade war escalation by the world's two largest economies.,Explainer: What tools could Trump use to get U.S. firms to quit China?,Fed's commitment to act upstaged by Trump's furor,Fed's Powell vs. Trump: who's got a 'feel' for markets now?,Week ahead on Wall Street,Wall Street sinks on trade tensions,Invest in U.S. stocks amid trade war - Pence,Wall Street Weekahead: Investors look at dollar stores as U.S. recession fears increase,"Answering Trump, UPS, FedEx and USPS say they already fight illegal drug shipments","Japan, U.S. reach framework trade pact, no U.S. concessions seen - Nikkei","FTC, AT&T; settle 2014 lawsuit over data slowdowns: court",California rare earths miner races to refine amid U.S.-China trade row,Trump administration considers boost to biofuel mandates to ease farmer anger: sources,"More investors are watching the shares of discount retailers like Dollar General Corp  and Dollar Tree Inc , which perform better during economic downturns, in the hopes of gauging changes in consumer behavior, though higher tariffs may erode the companies' ability to act as economic bellwethers.","FedEx Corp , United Parcel Service Inc  and the U.S. Postal Service said on Friday they are already working to stop traffickers from using their services after U.S. President Donald Trump ordered delivery firms to refuse packages of the powerful painkiller fentanyl from China.","The United States and Japan have reached the broad framework of a trade agreement, Japan's Nikkei business daily said on Saturday, with Tokyo making concessions on its agriculture but none immediately apparent from Washington on automobiles.","The Federal Trade Commission (FTC) and AT&T; Inc reached a settlement agreement on a 2014 case that accused the company of slowing down data sent to wireless devices, a federal court ruling showed on Friday.","The owner of the only U.S. rare earths mine is going on a hiring spree as it looks to significantly boost production, part of a strategy to build out American refining capability after China raised tariffs on the minerals amid an escalating trade war.","The Trump administration is considering ramping up biofuel blending quotas in the coming years to assuage anger in the Farm Belt over its recent broad use of waivers for small refineries, but is not planning to rescind any of the exemptions it has granted so far, four sources familiar with the matter said."
24,20190825,20190825103226,China to fight back against U.S. tariff move: People's Daily,"China will fight back against the latest U.S. step to increase tariffs on Chinese goods, the ruling Communist Party's People's Daily said on Sunday amid an escalating trade war between the world's two largest economies.",Explainer: What tools could Trump use to get U.S. firms to quit China?,Fed's commitment to act upstaged by Trump's furor,Fed's Mester sees downside risk from escalating trade war,What Trump can do to get U.S. factories out of China,Week ahead on Wall Street,Wall Street sinks on trade tensions,Wall Street Weekahead: Investors look at dollar stores as U.S. recession fears increase,Britain's Cuadrilla says 'micro seismic event' occurred at fracking site near Blackpool,"Answering Trump, UPS, FedEx and USPS say they already fight illegal drug shipments","Japan, U.S. reach framework trade pact, no U.S. concessions seen - Nikkei","FTC, AT&T; settle 2014 lawsuit over data slowdowns: court",California rare earths miner races to refine amid U.S.-China trade row,"More investors are watching the shares of discount retailers like Dollar General Corp  and Dollar Tree Inc , which perform better during economic downturns, in the hopes of gauging changes in consumer behavior, though higher tariffs may erode the companies' ability to act as economic bellwethers.",British shale gas company Cuadrilla Resources said a tremor measuring 2.1 ML on the Richter scale was recorded at the company's shale gas exploration site late on Saturday.,"FedEx Corp , United Parcel Service Inc  and the U.S. Postal Service said on Friday they are already working to stop traffickers from using their services after U.S. President Donald Trump ordered delivery firms to refuse packages of the powerful painkiller fentanyl from China.","The United States and Japan have reached the broad framework of a trade agreement, Japan's Nikkei business daily said on Saturday, with Tokyo making concessions on its agriculture but none immediately apparent from Washington on automobiles.","The Federal Trade Commission (FTC) and AT&T; Inc reached a settlement agreement on a 2014 case that accused the company of slowing down data sent to wireless devices, a federal court ruling showed on Friday.","The owner of the only U.S. rare earths mine is going on a hiring spree as it looks to significantly boost production, part of a strategy to build out American refining capability after China raised tariffs on the minerals amid an escalating trade war."
25,20190826,20190826132307,"Trump says China trade deal coming, Beijing calls for resolution","The United States and China sought to ease trade war tensions on Monday, with Beijing calling for calm and U.S. President Donald Trump predicting a deal after markets fell in response to new tariffs from both countries.",U.S. futures recover after Trump eases stance on China trade,Amgen to buy Celgene's psoriasis drug Otezla for $13.4 billion in cash,U.S. business investment appears weak in third quarter,Japan denies giving up 'too much' in trade talks,"Trump, Abe agree on principles of trade deal at G7",What Trump can do to get U.S. factories out of China,German court suspends restrictions on Facebook data gathering,"Tesla to raise prices in China on August 30, may increase again in December: sources",Trump says hopes doesn't have to consider tariffs on German cars,KFC to test Beyond Meat's chicken nuggets at Atlanta restaurant,Tencent launches WeChat for drivers,KKR becomes Axel Springer's biggest shareholder,A German court on Monday temporarily suspended a February decision by the cartel office to order Facebook  to restrict its data collection practices in Germany.,"U.S. electric vehicle maker Tesla Inc  will raise prices in China on Friday, earlier than planned, and is considering increasing prices again in December should Chinese tariffs on U.S.-made cars take effect, people familiar with the matter said.",U.S. President Donald Trump said on Monday that he and German Chancellor Angela Merkel discussed a trade deal with the European Union and said he hoped Washington would not have to consider imposing tariffs on German cars.,Yum Brands Inc  said on Monday it will be testing Beyond Meat Inc's  plant-based chicken nuggets at an Atlanta KFC restaurant.,"Tencent Holdings  on Monday unveiled a version of its popular social media app WeChat tailor-made for drivers with state-backed Chinese carmaker China Chang'an Automobile Group, marking a further foray into transportation solutions.","KKR  has become the biggest shareholder of German media group Axel Springer , paying 2.9 billion euros ($3.2  billion) for a 43.54% stake, the U.S. private equity firm said on Monday."
26,20190827,20190827114612,"Three U.S. bond kings wield same strategy, get same result: lag their peers","Three names dominate the U.S. world of bond investing - Jeffrey Gundlach, Dan Ivascyn and Scott Minerd. But funds run by these star investors are lagging their respective benchmarks this year.",China says it hopes U.S. can create conditions for trade talks,BlackRock takes aim at CEOs serving on other companies' boards,"GlobalFoundries sues TSMC, wants U.S. import ban on some products","Ferdinand Piech, architect of VW's global expansion, dies aged 82",J&J; must pay in landmark Oklahoma opioid ruling,Stocks rebound as Trump stokes trade optimism,EU's Vestager: checking to see if Google favors own job search tool,"Norway wealth fund should move more investments to North America, central bank says",Dutch regulator sees potential privacy breach in Microsoft Windows,Prosecutors raid Deutsche Boerse offices over share-trading scam,"Uber Eats, Japan convenience store Lawson form delivery tie-up",J&J; liable for $572 million in Oklahoma opioid epidemic trial; shares rise,"EU regulators are checking Google for Jobs to see if the company unfairly favors its fast-growing tool for searching job listings, Europe's antitrust chief said on Tuesday.","Norway's $1 trillion sovereign wealth fund, the world's largest, should shift billions in investments from European stock markets and instead invest more in the United States and other North American markets, the fund's manager recommended on Tuesday.","Microsoft is remotely collecting data from users of Windows Home and Windows Pro, in a potential breach of privacy rules, the Dutch Data Protection Agency (DPA) said on Tuesday.","Public prosecutors on Tuesday raided offices of German exchange operator Deutsche Boerse  as part of a broader investigation into a fraudulent share-trading scheme, Cologne  public prosecutor's office said.","Uber Eats and Japanese convenience store chain Lawson  on Tuesday announced a delivery partnership in central Tokyo, seeking to capitalize on growing demand for quick home delivery of food and everyday items.","An Oklahoma judge on Monday ordered Johnson & Johnson  to pay $572.1 million to the state for its part in fueling an opioid epidemic by deceptively marketing addictive painkillers, a sum that was substantially less than investors had expected, driving up J&J;'s shares."
27,20190828,20190828105100,Exclusive: Fake-branded bars slip dirty gold into world markets,A forgery crisis is quietly roiling the world's gold industry.,Exclusive: Financial hit from 737 MAX will not slow appetite for services deals - Boeing CEO,"U.S. yield curve inverts further, 30-year yields hit new record low",Costco limits shoppers in first China store after opening-day fiasco,DOJ charges ex-Google engineer with tech theft,Popeyes runs out of its famed chicken sandwich,DOJ charges ex-Google engineer with tech theft,Exclusive: Boeing CEO eyes major aircraft order under any U.S.-China trade deal,Facebook tightens rules for U.S. political advertisers ahead of 2020 election,Google to move Pixel smartphone production to Vietnam: Nikkei,Purdue Pharma in discussion on $10 billion-$12 billion offer to settle opioid lawsuits: sources,World stocks slip as bond markets ring recession alarms,Exclusive: Aramco Trading sells first U.S. West Texas Light crude to South Korea's Hyundai - sources,Boeing Co said on Tuesday that an aircraft order from China could result from any deal to end a yearlong trade war between the world's two largest economies.,"Facebook Inc is tightening its political ad rules in the United States, it said on Wednesday, requiring new disclosures for its site and photo-sharing platform Instagram ahead of the U.S. presidential election in November 2020.","Alphabet Inc's  Google is shifting its Pixel smartphone production to Vietnam from China starting this year as it builds a cheap supply chain in Southeast Asia, the Nikkei business daily reported on Wednesday.","OxyContin maker Purdue Pharma LP and its owners, the Sackler family, are in discussion to settle more than 2,000 opioid lawsuits against the company for $10 billion to $12 billion, two people familiar with the matter said on Tuesday.","World stocks nudged down on Wednesday as deepening inversion of the U.S. bond yield curve a day earlier threw up reminders of looming recession risks, sending investors toward safe havens such as the Japanese yen and precious metals.","Aramco Trading Company (ATC) sold its first-ever cargo of U.S. West Texas Light (WTL) crude, with a South Korean refiner the buyer, as the Saudi Aramco unit expands its U.S. oil dealings to boost trade volumes, four people familiar with the matter said."
28,20190829,20190829124527,China hopes U.S. will create conditions necessary for September trade talks,"China and the United States are discussing the next round of face-to-face trade talks scheduled in September, but hopes for progress hinge on whether Washington can create favorable conditions, China's commerce ministry said on Thursday.",South Korea court ruling raises chance of Samsung heir's return to jail,Apple to supply parts to independent repair shops for first time,U.S. second-quarter GDP growth revised to 2.0%,"Huawei plans flagship phone launch, without Google apps","Pernod lifts spirits with buyback, investments",As tariffs loom Apple remains dependent on China,Apple's data shows a deepening dependence on China as Trump's tariffs loom,Stock futures jump after China's positive comments on trade,Thyssenkrupp CEO's last roll of the dice: sell the family silver,Tesla rolls out insurance in California,Tencent scraps plan to invest $150 million in Chinese education firm VIPKid: sources,Best Buy's annual sales outlook misses estimates as tariffs loom,"Tapping factories in Brazil and India has not lessened Apple Inc's  dependence on China, the company's supply chain data shows, raising the stakes for the iPhone maker as U.S. President Donald Trump wages a trade war and promises more tariffs.","U.S. stock index futures jumped about 1% on Thursday as China sounded upbeat about its trade talks with the United States, calming investors unnerved by the prospect of a recession.","Thyssenkrupp  CEO Guido Kerkhoff has little choice but to sell the group's prized elevator division lock, stock and barrel so he can save the conglomerate's remaining businesses, four sources close to the German company said.","Tesla Inc  said on Wednesday it was launching an insurance service designed to give drivers in California, its biggest market, lower rates because of safety features on its electric vehicles.","Tencent  has shelved plans to invest about $150 million to lead a fresh fundraising round for a Chinese education firm VIPKid, two people familiar with the matter said, as Beijing moved to tighten oversight of online education platforms.","Best Buy Co Inc  forecast annual same-store sales below analysts' estimates on Thursday, citing new U.S. tariffs set to be imposed on Chinese imports, such as phones, video game consoles and other electronics."
29,20190830,20190830110741,"With racing and music events, Tesla gets over marketing allergy in China","Tesla Inc  has always shown disdain for marketing, with CEO Elon Musk boasting his company does not advertise, instead using the money it would have spent to develop products.",Japan's curbs on high-tech materials exports to South Korea could backfire,"China, U.S. trade negotiating teams maintaining 'effective communication': China",Boeing aims to strengthen engineering oversight after panel review,Soothing talk on trade lifts global stocks,FTC probes marketing practices of Juul: source,Wall Street rises on China trade hopes,Disabled workers chase 'dream jobs' in tight U.S. labor market,Month of bond market milestones - How low can you go?,"Tesla hikes prices for Model 3, other cars in China amid weaker yuan","Global stocks scale one-week high on trade hopes, yuan softens",Billionaire Fredriksen seeks investors for shipping-to-fish empire: media reports,Toyota won't build cars at UK factory the day after Brexit,"Megan Helsel, a kayaking wildlife specialist, has her dream job, and T'angelo Magee is making headway toward his, a commercial pilot. Both say work is central to their identity. Both are disabled.","August has turned out to be another month of milestones for bond markets as an escalating trade conflict fans recession fears, pushing borrowing costs deeper and deeper into negative territory.",U.S. electric vehicle maker Tesla Inc  had raised prices for some vehicles in China as the yuan trades at its weakest levels in more than a decade.,"World stocks rose to a one-week high on cautious hopes for a rapprochement on trade between Beijing and Washington on Friday, though a perky dollar capped gains with China's yuan softening again, on track for its weakest month in 2-1/2 decades.","Industrialist John Fredriksen is seeking investors to take larger stakes in his companies and could relinquish control of operations as part of a plan to reduce his workload, the Norwegian-born 75-year-old told two newspapers on Friday.",Japan's Toyota  will not build cars at its British factory the day after Britain leaves the European Union as part of plans to handle any disruption from a potentially disorderly Brexit.
